date,tweet
2018-05-09 09:45:46,$GOOGL straight up for the last 5 days off of $1010. Now around $1070.
2018-05-09 09:45:00,"The Market In 5 Minutes: Iran Deal, Google's Virtual Assistant, Walmart-Flipkart  https://benzinga.com/z/11675089  $WMT $SQ $GOOGL $TSLA $ADNT $ARWR $BECN $SMTC"
2018-05-09 09:44:06,$googl breaking out on daily over 50day
2018-05-09 09:37:59,$GOOGL $GM $TSLA https://seekingalpha.com/article/4171181-white-knight-coming-save-tesla?source=tweet …
2018-05-09 09:35:10,Trade the tech slice you want!  $FNGU & $FNGD! @NYSE FANG+ Index 3x/-3x ETNs. Index components: $FB $AAPL $AMZN $NFLX $GOOGL $BABA $BIDU $NVDA $TSLA $TWTR pic.twitter.com/UPokO79Gkr
2018-05-09 09:34:02,$MEET short ratio on 2018-04-13 is 5.53  http://sunshineavenue.com/stock/MEET/  $GOOGL 1.03 $BCOR 5.03 $WB 2.76 $TWTR 0.95
2018-05-09 09:31:34,"RT @HighTechGeekFr: Tech> Google Assistant, un petit futé en devenir: Lors de Googl -  http://bit.ly/2wqZyUR  #hightech  https://twitter.com/HighTechGeekFr/status/994195823423643648/photo/1 pic.twitter.com/ewmHfReWeN "
2018-05-09 09:26:40,Challenging Confluence. New $GOOGL analysis for subscribers  http://www.matrixtrade.com/stocks/ 
2018-05-09 09:25:20,#normal #daytrading #marketprofile #futures $spx $nasdaq $es_f $nq_f $cl_f $GC_f $XOM $amzn $googl $AVGO $AAPL $WFM $cvs $bac $td $WMT $COST $WFC $jnj $GE $GS $tsla $utx $fb $JPM $dis $MCD $mo $NKE $TGT $RHT $V #markets #money #trading #Trump pic.twitter.com/tRpYmJiVah
2018-05-09 09:21:56,"Alphabet Inc  (NASDAQ:GOOGL) 1,058.59 USD 0.00 (0.00%) Closed: May 9, 8:39 AM EDT · Disclaimer Pre-market 1,062.00 +3.41 (0.32%) #GoogleFinance"
2018-05-09 09:21:03,CB Insights: Number of artificial intelligence (AI) startup acquisitions since 2010:  Google:     14  Apple:       13  Facebook:  6  Amazon:     5  Intel:            5  Microsoft:   5  Twitter:       4  $GOOGL $AAPL $FB $AMZN $INTC $MSFT $TWTR Cash flow generated  ? funny🤣 pic.twitter.com/knh0nC1FFB
2018-05-09 09:19:13,Google suspends all ads related to Irish abortion referendum $GOOGL #GOOGL #Technology #Electronicvoting #Voting  http://zpr.io/nStdg 
2018-05-09 09:18:31,$ABBV $GOOGL $GILD https://seekingalpha.com/article/4170698-gilead-thankful-sold?source=tweet …
2018-05-09 09:13:22,Long $GOOGL...  https://twitter.com/cnet/status/994192762537787393 …
2018-05-09 09:07:13,$AMZN came up with a AWS service to spin off new nodes on #ETH $GOOGL Alphabet Inc is developing its own distributed digital ledger $FB is late to the party forming a blockchain team. Everybody has to embrace #Blockchain #Crypto Apps willbe replaced by DAPPS. #TheNewInternet #TRX
2018-05-09 09:06:18,#Apple had better unveil a major upgrade to #Siri at #WWDC or risk losing ground in voice-assisted #AI it will never make up.  https://mashable.com/2018/05/08/google-io-assistant-siri/#MLiUE2Yic5Om … via @mashable #GoogleIO #GoogleAssistant $AAPL $GOOGL
2018-05-09 08:56:18,"@InfoSecAcumen more a fascination as to why they think we need options strikes every $2.5 in $1000+ stocks, so AMZN, GOOGL and others too"
2018-05-09 08:50:09,Cute Japan Girl - watch full:  https://googl/MjKMCj 👉  http://sosante.mobi/r.php?uc=k_n1&v=35650403 … 👈   sunnylionsexy freevideo orgasmic creampie girlfriend belgium young girls fucking hardcore video gays crackhead blowjob porn grannyhandjobtubes porn beautiful auntys tel
2018-05-09 08:49:14,More on FAANG dominance in today's  http://StockNews.com  newsletter -  https://stocknews.com/news/fb-how-dominant-faang-has-become-part-2/ … $FB $AAPL $AMZN $NFLX $GOOG $GOOGL #stocks
2018-05-09 08:42:32,Googl⚪せんせーのマップで調べた結果... なぜ伸びた....
2018-05-09 08:36:28,$GOOGL above 61.8% in pre-market.  https://twitter.com/yodastocks/status/993991419315531776 …
2018-05-09 08:11:19,"Can Google replace photographers with an algorithm? Like all mediocre photographers, Googl  https://is.gd/QW51Z6  @silewconsulting @blacq2"
2018-05-09 08:11:09,$GOOGL probably grab some next week calls
2018-05-09 08:10:12,Alphabet Inc (GOOGL) Making Huge Bet With AI   #TrendingStory #TechTitans #CSuite #TechCompanyNews  Link:  https://stocknews.com/news/googl-alphabet-inc-googl-making-huge-bet-with-a-i/ …  Ref:
2018-05-09 08:09:28,"Google's AI Will Book Your Table, Write Your Emails, Teach Your Kids Manners $GOOGL -  http://hotpagenews.com/r/223007 "
2018-05-09 08:09:02,Wal-Mart vient de conclure cette opération majeure pour contrer Amazon  https://goo.gl/gjv3Qg  #bourse #finance $GOOGL
2018-05-09 08:03:24,BlackBerry Revenue Streams as a Software Company.....  $MSFT $AAPL $NVDA $BIDU $INTC $GOOGL @jimcramer @MadMoneyOnCNBC @CNBCnow @WSJ @business @SamsungMobile @BlackBerry @ReutersTech @CrackBerry pic.twitter.com/pjyq8qzhP5
2018-05-09 07:56:34,"$BA, $HMNY, $WMT, $GS, $GOOGL  http://wire.kapitall.com/investment-idea/the-morning-hype-moviepass-stock-drops-30-over-financials-googles-android-p-wants-to-help-your-phone-addiction-and-goldman-blames-market-volatility-on-public/ …"
2018-05-09 07:48:47,Getting people to upgrade Android devices is hard. $GOOG $GOOGL  https://www.wsj.com/articles/google-tries-to-ease-its-tech-bottleneck-1525858200 … pic.twitter.com/d8pVG7nO5s
2018-05-09 07:47:42,えへへ///
2018-05-09 07:47:24,"RT SJosephBurns ""Largest US companies by market cap...  $AAPL $AMZN $MSFT $GOOGL $FB  Tech, Tech, Tech, Tech, Tech  via charliebilello  pic.twitter.com/n9QD2xyQWC"""
2018-05-09 07:46:20,futures super! my SPX calls should up big! nflx googl tsla all looking good.  https://twitter.com/option_snipper/status/994040355908603905 …
2018-05-09 07:42:53,"‘The Stars In My Soul’, With Chadwick Boseman & Logan Coles Producing, Sells To Working Title   https://search.app.goo.gl/rve6p   Shared from my Googl"
2018-05-09 07:40:49,"Largest US companies by market cap...  $AAPL $AMZN $MSFT $GOOGL $FB  Tech, Tech, Tech, Tech, Tech  via @charliebilello pic.twitter.com/R8hQ6L2OPq"
2018-05-09 07:40:07,"7 key Google $GOOGL priorities driven home by its Developer Conference, via @TheStreet https://buff.ly/2FWuw72 "
2018-05-09 07:30:12,"Android P could outperform Apple's iOS with new AI features  https://yhoo.it/2jJ5FLi  by @JPManga $GOOG, $GOOGL  pic.twitter.com/lNVlgGyour"
2018-05-09 07:22:12,This is scary good. $GOOGL Google assistant to rule all other AI assistants:  https://youtu.be/FIa4JJLfzI0 
2018-05-09 07:18:22,$GOOGL The tech giant is rebranding its research division as its focus on AI intensifies.  https://stocknews.com/news/googl-alphabet-inc-googl-making-huge-bet-with-a-i/ …
2018-05-09 07:07:31,A Brand (APL) with just Hardware manufacturing capabilities always been praised more than a Brand (GOOGL) with huge Data capabilities. 😏 #alphabet✌🏼😻
2018-05-09 07:06:09,バレなきゃ大丈夫///
2018-05-09 07:04:57,KITTY PRICE EN MAIDE AVEC UNE QUEUE DANS LA BOUCHE  EPISODE 1 LA SUITE ANAL ICI  https://googl/Xv1AWV 👉  http://sosante.mobi/r.php?uc=k_n1&v=35483325 … 👈   coloured blowjob videos peperonity nikki benz superstars threesome free big ass mexican porno big tits blonde babestat
2018-05-09 07:02:50,正夢になるかな……///
2018-05-09 07:00:23,Sompo Japan Nipponkoa Asset Management CO. LTD. Has $21.32 Million Position in Alphabet Inc. (GOOGL) #japan  https://cmun.it/jqwhrm 
2018-05-09 06:57:55,……は……？？？ｗｗｗｗｗｗ
2018-05-09 06:56:17,"THE AI DISRUPTION BUNDLE: The guide to understanding how artificial intelligence is impacting the world (AMZN, AAPL, GOOGL)  pic.twitter.com/VtCftSBTq4"
2018-05-09 06:54:30,Googl Earthは、ほっとくと勝手にずっと回っている。ちなみに検索したのは、「世界一小さな公園」で、なんとこれがうちのすぐそばにある。  私の位置情報   https://glympse.com/0EG6-S145  pic.twitter.com/5flQKp6NrC
2018-05-09 06:50:34,彼の売り買いは凄く勉強になるんですよね。というのは標準回帰しても即売却という訳ではなさそうなんです。今彼が持っているGoogl、FCAU、RACEとか明らかに高値でも売らないんですね。しかし永久保有するような銘柄ばかりでもないと。
2018-05-09 06:48:04,"Waymo expands its true self-driving car program in Phoenix, reports @TheStreet $GOOGL  https://buff.ly/2jIojD6 "
2018-05-09 06:44:19,"Towercrest Capital Management Stake in Ishares Nasdaq Biotechnology Etf $GOOGL Has Upped by $1.03 Million as Stock Declined; Benjamin F Edwards & Company Has Upped Position in General Mtrs Co $GM by $848,290 as Stock Declined  https://kgazette.com/towercrest-capital-management-stake-in-ishares-nasdaq-biotechnology-etf-googl-has-upped-by-1-03-million-as-stock-declined-benjamin-f-edwards-company-has-upped-position-in-general-mtrs-co-gm-by/ …"
2018-05-09 06:38:18,"New post: ""THE AI DISRUPTION BUNDLE: The guide to understanding how artificial intelligence is impacting the world (AMZN, AAPL, GOOGL)""  https://ift.tt/2xmiX9F "
2018-05-09 06:16:46,Link video :  https://googl/Nhwmsu 👉  http://iclogonopop.mobi/r.php?uc=k_n6&v=35680365 … 👈   fake nude pics of siri davi phoenix marie nerd hunting video completo ava addams daughters pornvideo nicole aniston in anal charley chase vicki chase dani daniels full scene sara jay sh
2018-05-09 06:15:21,$GOOGL #Alphabet Inc Weekly Equity Idea Highlight - 2018 05 09: GOOGL has seen steady UAFRS-based (Uniform) ROA decline from 100%+ to 30% over the past 15 years as the company has aggressively invested to grow the business and their cash flow streams.…  http://dlvr.it/QSGBk0  pic.twitter.com/tbAi3pVO4q
2018-05-09 06:10:00,free male webcams     https://googl/biS2wb 👉  http://sosante.mobi/r.php?uc=k_n1&v=35723195 … 👈   pregnant sex 3gp videos hotmusculargaysex shemalecamilliandrade
2018-05-09 06:08:30,Keep Promote your Business in Online and Get instant result in Googl..For more info visit... https://atozbusinesssolutions.nowfloats.com/Keep-Promote-your-Business-in-Online-and-Get-instant-result-in-Google-Searching-/b48 …
2018-05-09 06:07:36,SEO Promotion Company in Nayapalli. Give result in Top Page of Googl..For more info visit... https://atozbusinesssolutions.nowfloats.com/SEO-Promotion-Company-in-Nayapalli-Give-result-in-Top-Page-of-Google-/b47 …
2018-05-09 06:05:12,"《定期》  ☆ Googl_SNSさん☆ パズドラ・モンスト垢販売の方です(^^)/ ★パズドラ★ ・強垢 ・魔法石多量垢 ・チートワンパン ★モンスト★ ・オーブ多量垢  その他に,,, 「データは売りたいけど、 詐欺には遭いたくない」 というか"
2018-05-09 06:03:05,FB vs. GOOGL: Which FANG Stock Had the Better Earnings Report?  https://finance.yahoo.com/news/fb-vs-googl-fang-stock-210809856.html?soc_src=community&soc_trk=tw … via @YahooFinance
2018-05-09 06:00:09,$GOOGL - Startup Challenging Advertising-Driven Platforms Sues Google  http://ih.advfn.com/p.php?pid=nmona&article=77379818&adw=1126416 …
2018-05-09 05:56:33,"THE AI DISRUPTION BUNDLE: The guide to understanding how artificial intelligence is impacting the world (AMZN, AAPL, GOOGL)  https://ift.tt/2xmiX9F "
2018-05-09 05:34:15,"THE AI DISRUPTION BUNDLE: The guide to understanding how artificial intelligence is impacting the world (AMZN, AAPL, GOOGL)  https://ift.tt/2xmiX9F   BI Intelligence  This is a preview of a research report bundle from Business Intelligence, Business Insi…  https://ift.tt/2y1pJPr "
2018-05-09 05:22:28,"THE AI DISRUPTION BUNDLE: The guide to understanding how artificial intelligence is impacting the world (AMZN, AAPL, GOOGL)  https://ift.tt/2xmiX9F  pic.twitter.com/RaBJe1Zgxm"
2018-05-09 05:22:06,"THE AI DISRUPTION BUNDLE: The guide to understanding how artificial intelligence is impacting the world (AMZN, AAPL, GOOGL)  https://read.bi/2xnNiQg "
2018-05-09 05:18:10,"THE AI DISRUPTION BUNDLE: The guide to understanding how artificial intelligence is impacting the world (AMZN, AAPL, GOOGL)  https://ift.tt/2xmiX9F  johnangel1977"
2018-05-09 05:17:09,"THE AI DISRUPTION BUNDLE: The guide to understanding how artificial intelligence is impacting the world (AMZN, AAPL, GOOGL) #website #news  https://ift.tt/2xmiX9F  pic.twitter.com/EikawGn25E"
2018-05-09 05:15:39,"THE AI DISRUPTION BUNDLE: The guide to understanding how artificial intelligence is impacting the world (AMZN, AAPL, GOOGL)  https://ift.tt/2xmiX9F "
2018-05-09 05:13:14,"10 Things To Know. THE AI DISRUPTION BUNDLE: The guide to understanding how artificial intelligence is impacting the world (AMZN, AAPL, GOOGL)  https://ift.tt/2xmiX9F "
2018-05-09 05:12:06,"THE AI DISRUPTION BUNDLE: The guide to understanding how artificial intelligence is impacting the world (AMZN, AAPL, GOOGL)  https://ift.tt/2xmiX9F "
2018-05-09 05:08:21,gay male webcam  live now   https://googl/Q8yjVa 👉  http://sosante.mobi/r.php?uc=k_n1&v=35718077 … 👈   tooyoungsexvideo emarati gaysex free porn vedio between wife with delivery boy hardcore video bareback tumblr live-home-cam
2018-05-09 05:08:18,"THE AI DISRUPTION BUNDLE: The guide to understanding how artificial intelligence is impacting the world (AMZN, AAPL, GOOGL)  https://read.bi/2z2x5Ch  pic.twitter.com/32eEFTUNqG"
2018-05-09 05:03:27,#GlobalBigDay #Springwatch #Manchester  https://mancunianbirder.wordpress.com/2018/05/09/greater-manchester-represented-on-global-big-day-2018/ … @MancunianSpring @MarkHChampion @Lancswildlife @NatureInSalford @SalfordMartin @EugeneDH_Bass @BBCSpringwatch @Lindsey_Chapman @LeeEvansBirding @BirdGuides @austinmorley402 @RareBirdAlertUK @googl_phil @MCRMetrolink
2018-05-09 05:01:18,Stocks GOOGL (Daily) Trade Signal Long 1056.54 MT Alpha SAR -UTC-20180508-134510  https://itraderobotsignals.net/2018/05/08/stocks-googl-daily-trade-signal-long-1056-54-mt-alpha-sar-utc-20180508-134510/ … pic.twitter.com/OiAFgOhQXM
2018-05-09 05:00:20,"Here&#039;s everything Google unveiled at its biggest conference of the year (GOOG, GOOGL)  #SmallBiz http://uk.businessinsider.com/google-io-live-blog-updates-coverage-2018-5 …"
2018-05-09 04:56:01,"UK's retail experience, but is related to a trend I've been monitoring in US Ecommerce Stocks that are included in $DJECOM.  Includes these stocks $GOOGL $AABA $AMZN $EFTC $EBAY $EXPE $FB $GRPN $NFLX $P $PYPL $CRM $AMTD $TRIP $TWYR https://twitter.com/NicTrades/status/994132349502808065 …"
2018-05-09 04:36:16,gay wrestling  join my show   https://googl/tLzXzB 👉  http://sosante.mobi/r.php?uc=k_n1&v=35719395 … 👈   Wwwdr sexual com porn gay drugged forced sleeping Www livesexclips com
2018-05-09 04:31:44,live gay cam to cam live  live on   https://googl/AhshUc 👉  http://sosante.mobi/r.php?uc=k_n1&v=35694667 … 👈   sex window porn hotel bebe enjoys bigdick kakey and white guy 3gpking gay naruto www indianhiddencams comyouporn www barebacked porno hot-boylivesex
2018-05-09 04:25:16,"Here's everything Google unveiled at its biggest conference of the year (GOOG, GOOGL)  http://dlvr.it/QSFg76  pic.twitter.com/kdhYcktDSS"
2018-05-09 04:05:12,free gay webcam     https://googl/pDDVi8 👉  http://sosante.mobi/r.php?uc=k_n1&v=35722923 … 👈   big dick bitch xxx pics all free gay grandpa and grandson porn does mom ass feel too big
2018-05-09 03:53:07,bareback free men cams  live at   https://googl/Vwj6Rf 👉  http://sosante.mobi/r.php?uc=k_n1&v=35699083 … 👈   www qoosex com mayhotbook videos htm bigdickbitch free porn movies kerala gay big cock spy cam wc men xxx barebacking www girs hot boys sexymovies secretcamgay
2018-05-09 03:48:08,free gay cam show  see me now   https://googl/kz8wdV 👉  http://sosante.mobi/r.php?uc=k_n1&v=35720619 … 👈   batista gay porn camilla belle tape free twink cfnm videos
2018-05-09 03:42:00,livecam free gay cam chat rooms  live everyday on   https://googl/94bQmD 👉  http://sosante.mobi/r.php?uc=k_n1&v=35695271 … 👈   marefucker bigdick gaysportpeperonity amaure twink videos underaged boy and woman porn porn coprofagos gay-moviesgay
2018-05-09 03:38:53,"Heres everything Google unveiled at its biggest conference of the year (GOOG, GOOGL) (Dave Smith and Greg Sandoval/Business Insider: Tech)  http://dlvr.it/QSFSHp "
2018-05-09 03:36:54,"$GOOGL #Alphabet Inc Google I/O - Focus on AI: At its I/O developer conference, Google reaffirmed its leadership position in AI, showcasing applications of the technology across a range of services. Most significant of these is the Google Assistant and…  http://dlvr.it/QSFRym  pic.twitter.com/txYqdNosJW"
2018-05-09 03:17:39,"Here's everything Google unveiled at its biggest conference of the year (GOOG, GOOGL)  https://ift.tt/2rt9Kqs  pic.twitter.com/XafPzo4gzA"
2018-05-09 03:10:28,"What's new with Development Tools at Google I/O 2018  https://ift.tt/2rt2Lh2   Google's platforms, from Android to Chrome to Daydream to Cloud, are nothing without their developers.  Android and Chrome used to be known for how difficult they were to build for. Not anymore. Googl…  pic.twitter.com/wHUVnLhlkx"
2018-05-09 03:10:09,"Here's everything Google unveiled at its biggest conference of the year (GOOG, GOOGL)  https://ift.tt/2wucFoC "
2018-05-09 03:10:03,"The next version of Android could help you use your smartphone a lot less &mdash; here's everything that's new in Android P (GOOG, GOOGL)  https://ino.to/7ukni6M  via @Inoreader"
2018-05-09 03:08:16,"New post: ""The next version of Android could help you use your smartphone a lot less — here's everything that's new in Android P (GOOG, GOOGL)""  https://ift.tt/2FWm1bX "
2018-05-09 03:08:14,"New post: ""Google is relaunching its news site with lots more artificial intelligence as part of its effort to fight fake news (GOOGL, GOOG)""  https://ift.tt/2FTjoI1 "
2018-05-09 03:08:14,"New post: ""Google just made a bunch of updates to its smart assistant — here are all the new things your Google Home can do (GOOG, GOOGL)""  https://ift.tt/2rsMGbe "
2018-05-09 03:07:58,livecam gay wrestling  join my show   https://googl/o32y5f 👉  http://sosante.mobi/r.php?uc=k_n1&v=35694385 … 👈   bigdickmoma gay massage movies com streptesse cam jim ferro bareback video shemalecamilli ros tube gayfriendstv com bigdickstraight-friend
2018-05-09 03:07:56,"Here's everything Google unveiled at its biggest conference of the year (GOOG, GOOGL)  https://ift.tt/2I1fGlq "
2018-05-09 03:07:01,"Here's everything Google unveiled at its biggest conference of the year (GOOG, GOOGL)  https://read.bi/2K87NY1 "
2018-05-09 03:06:36,"Here's everything Google unveiled at its biggest conference of the year (GOOG, GOOGL)  pic.twitter.com/ypp9EotTuI"
2018-05-09 03:06:24,"The next version of Android could help you use your smartphone a lot less — here's everything that's new in Android P (GOOG, GOOGL)  pic.twitter.com/cJnZ15n5a9"
2018-05-09 03:06:20,"Google is relaunching its news site with lots more artificial intelligence as part of its effort to fight fake news (GOOGL, GOOG)  pic.twitter.com/DpRpMtcfk0"
2018-05-09 03:06:19,"Google just made a bunch of updates to its smart assistant — here are all the new things your Google Home can do (GOOG, GOOGL)  pic.twitter.com/TdzYCknEt6"
2018-05-09 03:04:20,"Alphabet Inc.(""Google"") - Class A (GOOGL) price at close, 2018-05-08, is 1058.59."
2018-05-09 03:03:46,"Here's everything Google unveiled at its biggest conference of the year (GOOG, GOOGL)  https://read.bi/2InIVy9  pic.twitter.com/O7aWyAlFrI"
2018-05-09 03:02:27,"The next version of Android could help you use your smartphone a lot less — here's everything that's new in Android P (GOOG, GOOGL)  https://ift.tt/2IlqOcp "
2018-05-09 02:55:35,"Here’s everything Google unveiled at its biggest conference of the year (GOOG, GOOGL)  http://www.occuworld.org/news/4146455 "
2018-05-09 02:36:05,"Google I/O: Android P, new Assistant voices, Maps gets social and AR  https://seekingalpha.com/news/3353920-google-o-android-p-new-assistant-voices-maps-gets-social-ar?source=tweet … $GOOG $GOOGL"
2018-05-09 02:34:17,RT adsols4: #DigitalMarketing #SEO #AriyalaITsolution #Adssol #digiariyala #Chennai #Coimbatore #Tamilnadu #Mysore #Banglore #Webdevelopment #Google #SMO #searchengineoptimization #bloggers #googleranking #socialmedia #rankingfactors #GoogleUpdate #Googl…  pic.twitter.com/Htc5QEZjYz
2018-05-09 02:30:41,"Here's everything Google unveiled at its biggest conference of the year (GOOG, GOOGL)  https://read.bi/2wmBQck  #tech #business #success pic.twitter.com/jVP5aZo6rN"
2018-05-09 02:29:28,RT adsols4: #DigitalMarketing #SEO #AriyalaITsolution #Adssol #digiariyala #Chennai #Coimbatore #Tamilnadu #Mysore #Banglore #Webdevelopment #Google #SMO #searchengineoptimization #bloggers #googleranking #socialmedia #rankingfactors #GoogleUpdate #Googl…  pic.twitter.com/Htc5QEZjYz
2018-05-09 02:29:19,スマホのスケジュールに予定とかいれようと思ったけど、googlにするかドコモのにするか･･･googlのが汎用性高そうだけど今までたまに使ってたのがドコモの方なのよね
2018-05-09 02:24:13,RT adsols4: #DigitalMarketing #SEO #AriyalaITsolution #Adssol #digiariyala #Chennai #Coimbatore #Tamilnadu #Mysore #Banglore #Webdevelopment #Google #SMO #searchengineoptimization #bloggers #googleranking #socialmedia #rankingfactors #GoogleUpdate #Googl…  pic.twitter.com/Htc5QEZjYz
2018-05-09 02:22:49,"Google Lens actually shows how AI can make life easier  http://factnew.com/technology/google-lens-actually-shows-how-ai-can-make-life-easier-2/ …    During Google’s I/O developer conference keynote, artificial intelligence was once again the defining theme and Google’s guiding light for the future. AI is now interwoven into everything Googl...  pic.twitter.com/nYTG91SJHn"
2018-05-09 02:21:16,"Google Photos will soon be able to automatically add color to old black and white photos (GOOG, GOOGL)  http://dlvr.it/QSF7nn "
2018-05-09 01:29:01,"Google is relaunching its news site with lots more artificial intelligence as part of its effort to fight fake news (GOOGL, GOOG)  https://read.bi/2KNFjnp "
2018-05-09 01:21:37,"Night Most Tweeted Big Caps, check out Gambiste Top 10: $FANG $EA $JD $CELG $GOOGL $FB $AAPL $AMZN  http://gambiste.com/index.php/current-month-stock-data/ …"
2018-05-09 01:08:49,free men webcam     https://googl/3rkbgX 👉  http://iclogonopop.mobi/r.php?uc=k_n6&v=35722473 … 👈   salman khan gaysex daddy its too big vid
2018-05-09 01:08:37,Its 1.5 m. A gengar is just 13 cm smaller than me thx googl
2018-05-09 01:07:22,Wed’s Watch 2 $FB $NVDA $GOOGL $INTC $LTC.X $NFLX $LMT $MA $MELI $MSFT $MTCH $MU $NTNX $OLED $PYPL $EYES $GDOT $HEAR $MNKD $MYO $PLUG $MYL pic.twitter.com/1qZq6eL6EI
2018-05-09 00:59:28,"Exactly. Liquid cooling is a bug, not a feature. $googl"
2018-05-09 00:40:24,"Google’s AI will book your table, write your emails, teach your kids manners  https://www.bloomberg.com/news/articles/2018-05-08/google-flexes-ai-muscle-while-chasing-rivals-at-i-o-conference … via @technology $GOOGL $GOOG"
2018-05-09 00:11:59,live cam men   watch me   https://googl/PZD2gr 👉  http://sosante.mobi/r.php?uc=k_n1&v=35721295 … 👈   WWW myanmar gaysex www india livesex com lesbian seduces straight friend porn video
2018-05-09 00:01:15,$NVDA $INTC $TSM $AVGO $ARM $AMD $IBM $GOOGL  https://www.wsj.com/articles/china-plans-47-billion-fund-to-boost-its-semiconductor-industry-1525434907 …
2018-05-09 00:00:23,"$AMZN to buy $RAD sources say, $WFC $GOOGL $FB $V $AAPL $ONCE $WMT $TGT #Options #Stocks #Amazon #RiteAid #Pharmaceutical #MergerWhen pic.twitter.com/a7CzL0i3RA"
