date,tweet
2017-03-12 19:59:07,اللهم ارحم موتانا وموتى المسلمين اللهم اشف مرضانا ومرضى المسلمين  http://7asnat.com/ 
2017-03-12 19:58:15,"$GOOGL closed on Fri w/ ATH closing price. macd golden cross. vol is good but not great though. support @ 858.7. if breaks 867, see 876-878.  pic.twitter.com/wwyuYF3vGC"
2017-03-12 19:56:04,اللهم إنك تعلم عيوبنا فاسترها وتعلم حاجاتنا فاقضها كفى بك وليًا وكفى بك نصيرًا .  http://d3waapp.org/ 
2017-03-12 19:49:09,Is Google another step closer to being unblocked in China?  http://bit.ly/2me99UH  via @SCMP_News $GOOG $GOOGL
2017-03-12 19:47:18,ما من عبدٍ يذنب ذنباً فيحسن الطهور ثم يقول فيصلي ركعتين ثم يستغفر الله إلا غفر الله لهُ  http://du3a.org 
2017-03-12 19:44:49,رضيت بالله رباً وبالإسلام ديناً وبمحمد صلى الله عليه وسلم نبياً  http://du3a.org 
2017-03-12 19:41:49,اللهم أرزقني الإخلاص في القول والنية والعمل  http://d3waapp.org/ 
2017-03-12 19:36:57,Facebook $FB Amazon $AMZN Netflix $NFLX Alphabet $GOOGL all at #SXSW  with #SocialMedia #sport #machinelearning  http://traderscommunity.com/forum/index.php?topic=1230.0 …
2017-03-12 19:33:05,اللهم أجرنا من النار  http://7asnh.com 
2017-03-12 19:23:31,Are Google's search results getting worse? $GOOG $GOOGL  http://www.seekingalpha.com/news/3250505 
2017-03-12 19:18:36,يا حي يا قيوم برحمتك أستغيث أصلح لي شأني كُله  http://ghared.com 
2017-03-12 19:17:51,حبيت أشكر كل القوى الأسلامية و الوطنية  بمخيم عين الحلوة بس خفت يزعل googl
2017-03-12 18:59:11,اللهم بشرني بالجنه ، اللهم ارزقني الفردوس الاعلى من غير حساب ولا سابقة عذاب  http://7asnat.com/ 
2017-03-12 18:55:45,اللهم لا تجعلنا ممن ضل سعيهم في الحياة الدنيا وهم يحسبون انهم يحسنون صنعا.  http://d3waapp.org/ 
2017-03-12 18:53:55,﷽ ﴿بسم الله الرحمن الرحيم ويل للمطففين﴾ ⬅️  http://du3a.org 
2017-03-12 18:52:27,Learn to Read SEC Filings DVD:  http://smq.tc/1GdpNHv  This DVD is pure gold!  $SLV $TWTR $Spy $GOOGL $IBB $TSLA $PCLN $CELG $LNKD
2017-03-12 18:51:47,FREE DAILY OPTION TRADE. Sign up for our DAILY FREE TRADE at  http://ExactOptionPicks.com  $AAPL $NFLX $AMZN $GOOGL $GS $AMD $FB $NVDA $PCLN
2017-03-12 18:49:23,disk #opportunity ip mining #shift typeface #storage googl desktop #webhosting
2017-03-12 18:43:29,دعاء دخول الخلاء:{بسم الله} اللهُمَّ إنّي أعُوذُ بِكَ مِنَ الخُبْثِ والخبائِثِ  http://du3a.org 
2017-03-12 18:42:53,ربي اغفر لي و أرحمني  http://d3waapp.org/ 
2017-03-12 18:33:04,اللهم إني أسألك علماً نافعاً ورزقاً طيباً وعملاً متقبل  http://du3a.org 
2017-03-12 18:33:01,استغفر اللهِ االعظيم ..بعدد من .. ذكر ۉشكر ! ااستغفر اللهِ االعظيم .. بعدد من صلى ۉكبر ..  http://7asnh.com 
2017-03-12 18:07:18,الذكر عند الخروج من المنزل:بسم الله توكَّلْتُ على الله  http://ghared.com 
2017-03-12 18:05:02,قد نثرت ياربُ دعائي ، فإرحم اللهم ضعفي ورجائي  واجب دعوةً في لب قلبي ، وازل يارب همي وشقائي  http://du3a.org 
2017-03-12 17:57:38,اللهم يا مقلب القلوب ثبت قلوبنا وقلوب اخواننا على دينك وطاعتك  http://7asnat.com/ 
2017-03-12 17:53:13,Should we buy @amd at the open tommorow? $amd $nvda $avgo $QCOM $FB $snap #amd #amdryzen $FB $AAPL $BAC $MON $GILD $xlk $GOOG $googl #goog
2017-03-12 17:44:58,أذكار الأذان:يدعو لنفسه بين الأذان والإقامة فإن الدعاء حينئذٍ لا يرد  http://du3a.org 
2017-03-12 17:41:09,﷽ ﴿إذ همت طائفتان منكم أن تفشلا والله وليهما ۗ وعلى الله فليتوكل المؤمنون﴾ ⬅️  http://du3a.org 
2017-03-12 17:40:32,اللهم يا مالك الكون إكفنا شر ما يكون قبل ان يكون  http://d3waapp.org/ 
2017-03-12 17:36:31,CEO Steps Down at Alphabets Project Loon after Just Six Months #Alphabet $GOOGL #wlst  http://fortune.com/2017/03/12/alphabet-project-loon-ceo … pic.twitter.com/EnAMSf1ZId
2017-03-12 17:36:28,CEO Steps Down at #Alphabet’s Project Loon after Just Six Months - FORTUNE. $GOOGL  https://apple.news/AKS-PFUsbSVqMsJ0Xpu5fKA …
2017-03-12 17:32:09,لا حول ولا قوة إلا بالله لا إله إلا الله ولا نعبد إلا إياه له النعمة وله الفضل وله الثناء الحسن  http://7asnh.com 
2017-03-12 17:32:09,اللَّهُمَّ إِنِّي أَعوذُ بِرِضاكَ مِنْ سَخَطِكَ، وَبِمعافاتِكَ مِنْ عُقوبَتِكَ، وَأَعوذُ بِكَ مِنْكَ.  http://7asnh.com 
2017-03-12 17:30:33,"Sorry technologists, but #Google $GOOGL #selfdrivingcars just aren't that good. Project rife with limitations. -@techreview #tech #critique pic.twitter.com/lOmopHMRWM"
2017-03-12 17:10:51,اللهم أعذنا من عذاب القبر وعذاب جهنم ♻️  http://zad-muslim.com 
2017-03-12 17:00:48,Mana para penggila film BOKEP ? Nih pasang aplikasi RIBUAN film bokep di  https://googl/lGlCtR Sebarkan ke temen2 yang lain ya!!!
2017-03-12 17:00:22,$EURUSD:1.07  $EURGBP:0.88 $AAPL: 139.1$ (+0.33%)  $GOOGL: 861.4$ (+0.416%) S&P500: 2372.60(+0.33%)
2017-03-12 16:56:48,دعاء الجلسة بين السجدتين:رب اغفر لي  http://7asnat.com/ 
2017-03-12 16:55:22,أذكار الأذان:يدعو لنفسه بين الأذان والإقامة فإن الدعاء  http://du3a.org 
2017-03-12 16:53:14,استغفر الله  http://d3waapp.org/ 
2017-03-12 16:47:00,﷽ ﴿فوسوس إليه الشيطان قال يا آدم هل أدلك على شجرة الخلد وملك لا يبلى﴾ ⬅️  http://du3a.org 
2017-03-12 16:45:41,email #googl iterate information #macro #workstation #milestone #dashboard worm #bash
2017-03-12 16:42:08,"Yuntab Quad Core A33 1,5 GHz Q88 Tablette Tactile PC Android 4.4 Wifi Rom 8 Go HD 1024 x 600 Support 3D Jeux Googl  http://wp.me/p7XJ1x-t5 "
2017-03-12 16:40:58,Are Google's search results getting worse? $GOOG $GOOGL  http://www.seekingalpha.com/news/3250505 
2017-03-12 16:40:36,الله أكبر  http://d3waapp.org/ 
2017-03-12 16:40:15,"Mind blowing fact: The founders of Google were willing to sell Google for $1 million to Excite in 1999, but Excite turned them down. Googl …  pic.twitter.com/efD0XrZyaA"
2017-03-12 16:31:05,الحمد لله لا إله إلا الله وحده لا شريك له له الملك وله الحمد وهو على كل شيء قدير  http://7asnh.com 
2017-03-12 16:28:17,【アプリ情報】 綾部がアプリに登場だ！ 今日から綾部のプロデューサーにならないか(о´∀`о)  くるたまアプリ AppStore  https://itunes.apple.com/us/app/kurutama/id1169861209?l=ja&ls=1&mt=8 … Googl
2017-03-12 16:24:20,3Novices:Learn To Navigate Reputation And Risk With Former Counterintelligence Agents Justin And Tonya Recla  http://ift.tt/2mgaoTt  Googl…
2017-03-12 16:24:17,سبحان الله والحمد لله والله أكبر  http://ghared.com 
2017-03-12 16:14:13,"Three players Newcastle United fans would love to see return, including two Crystal Palace players https://www.googl…  pic.twitter.com/G9CAzqBk5c"
2017-03-12 16:13:34,$GOOGL....different view..$GOOG.....  pic.twitter.com/TAl90OA3bm
2017-03-12 16:12:08,$GOOGL...looks interesting...$GOOG......#google .... pic.twitter.com/KyARJPOOGI
2017-03-12 16:08:17,Google's CEO and Apple's CEO were spotted together at a restaurant #CEO #AAPL $GOOGL  http://wlst.com   http://finance.yahoo.com/news/googles-ceo-apples-ceo-were-144136707.html …
2017-03-12 16:06:06,googl/1QePoI  #OpKillingBay #ALieToldOftenEnoughBecomesTheTruth
2017-03-12 16:05:05,اللّهُـمَّ عافِـني في بَدَنـي ، اللّهُـمَّ عافِـني في سَمْـعي ، اللّهُـمَّ عافِـني في بَصَـري ، لا إلهَ إلاّ أَنْـتَ  http://du3a.org 
2017-03-12 15:55:37,استغفر الله العظيم واتوب إليه  http://7asnat.com/ 
2017-03-12 15:54:21,ربي أعوذ بك من الكسل وسوء الكبر  ♻️  http://zad-muslim.com 
2017-03-12 15:52:55,$GOOGL $BIDU $NTES worthy read + mentioned lvls/thoughts  Is Google another step closer to being unblocked in China?  http://bit.ly/2me99UH  pic.twitter.com/L2HMYnaIsW
2017-03-12 15:52:55,اللهم أذق قلوبنا برد عفوك وحلاوة حبك وافتح مسامع قلوبنا لذكرك وخشيتك واغفر لنا بكرمك وأدخلنا جنتك برحمتك  http://d3waapp.org/ 
2017-03-12 15:52:26,﷽ ﴿أم خلقوا السماوات والأرض ۚ بل لا يوقنون﴾ ⬅️  http://du3a.org 
2017-03-12 15:39:37,اللهم إني أسألك الجنة وأعوذ بك من النار  http://d3waapp.org/ 
2017-03-12 15:36:07,Many of the vulnerabilities identified by WikiLeaks have since been patched by several tech companies  http://trib.al/566y8sY  $AAPL $GOOGL
2017-03-12 15:32:56,Achei que gostaria deste Pin no Pinterest...  http://pin.it/NuL_cQu  Jades maravilhosas AURIBERTA E O MUNDO  http://www.auribertaeomundo.com  Googl G+
2017-03-12 15:30:34,سبحان الله وبحمده عدد خلقه ورضا نفسه وزنة عرشه ومداد كلماته  http://7asnh.com 
2017-03-12 15:22:26,Newcastle's home form is a concern - but a sense of perspective is also needed after Fulham defeat https://www.googl…  pic.twitter.com/6Eybg7qSaU
2017-03-12 15:20:29,حسبي الله لا إله إلا هو عليه توكلت وهو رب العرش العظيم  http://ghared.com 
2017-03-12 15:19:52,﷽ ﴿تكاد السماوات يتفطرن منه وتنشق الأرض وتخر الجبال هدا﴾ ⬅️  http://du3a.org 
2017-03-12 15:10:32,googl a random shakr and pit it on ur ocs head thats wat im try to do
2017-03-12 15:00:05,$GOOGL Short and sweet: Options win in Google  http://bit.ly/GOOGL_options  pic.twitter.com/PGjedqkS53
2017-03-12 14:59:39,#SXSW Innovation & Disruption #FANG #SocialMedia Tech Guide @TradersCom @HeidsterTrades $FB $AMZN $NFLX $GOOGL  http://traderscommunity.com/forum/index.php?topic=1230.0 … pic.twitter.com/k1IuB4LCli
2017-03-12 14:54:36,اللهم إني أسالك الهدى والتقى والعفاف والغنى  http://7asnat.com/ 
2017-03-12 14:54:13,سبحان الله والحمد لله والله أكبر ♻️  http://zad-muslim.com 
2017-03-12 14:51:50,لا إله الا الله محمد رسول الله  http://d3waapp.org/ 
2017-03-12 14:50:36,Mar12: 866 on t\u2026 $GOOGL  http://www.tradingview.com/chart/GOOGL/BwfWzqVu-Mar12-866-on-the-cards-and-then-either-double-top-or-fade-play/ …
2017-03-12 14:50:04,لا إله إلا الله وحده لا شريك له له الملك وله الحمد وهو على كل شيء قدير  http://du3a.org 
2017-03-12 14:46:46,digr_io RT QUIUQ: Alphabet's Eric Schmidt: Countries will fight over big data! • $GOOG $GOOGL • #Business #Finance…  http://www.businessinsider.com/google-eric-schmidt-countries-will-fight-over-big-data-alphabet-cloud-2017-3 …
2017-03-12 14:42:12,Don't sleep on the self-driving car revolution $NVDA $BIDU $GOOGL $GOOG $DLPH $F $GM $LYFT $BMWYY pic.twitter.com/TbMzTmffm3
2017-03-12 14:39:07,إجعل من حسابك في تويتر صدقة جارية لك في حياتك وبعد مماتك  http://d3waapp.org/ 
2017-03-12 14:30:10,يا مقلب القلوب ثبت قلبي على دينك  http://7asnh.com 
2017-03-12 14:23:21,$GOOGL Whoa!  https://twitter.com/stocktrader300/status/840990198376873984 …
2017-03-12 14:12:41,wining candidate win by thin margin.If bso we not in fray then whole muslims wd hv voted fr it.BTW it has 35% m pop src n googl
2017-03-12 14:02:29,Вакансия!!! Рекрутинг в IT сфере (работа он-лайн).  / Ссылка для регистрации:  /  https://sites.googl..  https://vk.cc/6mtO8n 
2017-03-12 14:01:20,#opensource #gaming #analog googl notepadplusplus tls #storage script desktop #curate
2017-03-12 14:00:33,"MacIntyre's Thoughts: Cannibal media, the analytics altar and a game of poetry - Vancouver Sun  http://buff.ly/2mxTcL6  | analytics - Googl…"
2017-03-12 13:59:31,"Here's the CEO of YouTube's favorite job interview question to ask (GOOG, GOOGL)   http://read.bi/2njbqQi  pic.twitter.com/PbjB44T7ZV"
2017-03-12 13:54:01,اللهم إني أسألك الجنة وأعوذ بك من النار  http://du3a.org 
2017-03-12 13:53:54,اللهم ما أصبح بي من نعمة أو بأحد من خلقك فـمنك وحدك لا شريك لك فلك الحمد ولك الشكر  http://7asnat.com/ 
2017-03-12 13:52:58,"5 internet stocks you should buy right now, according to Citi $FB $GOOGL $AMZN $PCLN $EBAY  http://on.mktw.net/2mzg4cR  http://bit.ly/2YouTubeTV "
2017-03-12 13:52:13,﷽ ﴿ولا تكونوا كالذين نسوا الله فأنساهم أنفسهم ۚ أولئك هم الفاسقون﴾ ⬅️  http://du3a.org 
2017-03-12 13:51:00,دعاء الخروج من المسجد:بسم الله والصلاة والسلام على رسول الله اللهم إني أسألك من فضلك اللهم اعصمني من الشيطان الرجيم  http://d3waapp.org/ 
2017-03-12 13:40:45,#catpcha scroll #project #userinterface #cs typeface widget #binary #junk googl #augmentedreality
2017-03-12 13:39:03,اللهم أنت ولينا فاغفر لنا وارحمنا وأنت خير الغافرين* واكتب لنا في هذه الدنيا حسنةً وفي الآخرة  http://d3waapp.org/ 
2017-03-12 13:29:09,ربّي بيدك سعَادتي وشقائي. ربّي أسعَد لي قلبي، ربّي أسعَد لي قلبي ، ربّي أسعَد لي قلبي ..  http://7asnh.com 
2017-03-12 13:29:08,اللهم أنت عضدي وأنت نصيري بك أجول وبك أصول وبك أُقاتل  http://7asnh.com 
2017-03-12 13:17:52,اللهم إني أسألك علماً نافعاً ورزقاً طيباً وعملاً متقبل  http://ghared.com 
2017-03-12 13:09:53,"A Geezer$ Alert :  GOOG,GOOGL: Are Google's search results getting worse?  http://ln.is/blogspot.com/B5fpM …"
2017-03-12 13:08:02,Are Google's search results getting worse? $GOOG $GOOGL  http://www.seekingalpha.com/news/3250505 
2017-03-12 13:06:45,@ESPNBrasil_ @espn em Chicago se pinta o rio inteiro de verde! Pesquisem Chicago River St Patrick's day no googl
2017-03-12 12:58:09,Hot new story Uptime is a goofy video sharing app from Googl...  http://www.theverge.com/2017/3/12/14898914/uptime-goofy-video-sharing-app-google-area-120-startup-incubator … #icymi #tech #socialmedia pic.twitter.com/FXS06P7biB
2017-03-12 12:52:39,اللهم اسألك الهدى والسداد  http://7asnat.com/ 
2017-03-12 12:49:42,اللهم بشرني بالجنه ، اللهم ارزقني الفردوس الاعلى من غير حساب ولا سابقة عذاب  http://d3waapp.org/ 
2017-03-12 12:49:17,ما يقول من خاف قوماً:اللهم اكفنيهم بما شئت  http://du3a.org 
2017-03-12 12:46:35,GOOGL - Are Google's search results getting worse? - Are Google's search results getting worse? Seeking Alpha -...  http://ow.ly/Wxgo50a8hHZ 
2017-03-12 12:39:43,سبحان الله وبحمده عدد خلقه ورضا نفسه وزنة عرشه ومداد كلماته ♻️  http://zad-muslim.com 
2017-03-12 12:37:04,Are Google's search results getting worse?  http://dlvr.it/Nc8Xdm  #GOOG #GOOGL
2017-03-12 12:36:25,سبحان الله والحمد لله والله أكبر  http://d3waapp.org/ 
2017-03-12 12:35:48,﷽ ﴿لا يسمعون حسيسها ۖ وهم في ما اشتهت أنفسهم خالدون﴾ ⬅️  http://du3a.org 
2017-03-12 12:32:00,"Diane Greene, one of the most powerful woman in tech, just promised to protect other women at Google (GOOG, GOOGL)  http://read.bi/2mGCiw4 "
2017-03-12 12:31:01,Are Google's search results getting worse?  http://seekingalpha.com/news/3250505-googles-search-results-getting-worse?source=tweet … $GOOG $GOOGL
2017-03-12 12:28:09,اللهم أحسن عاقبتنا في الأمور كلها، وأجرنا من خزي الدنيا وعذاب الآخرة  http://7asnh.com 
2017-03-12 12:28:00,لا إله إلا الله الواحد القهار ربُّ السموات والأرض وما بينهما العزيز الغفار  http://du3a.org 
2017-03-12 12:27:43,رَبَّنَا اغْفِرْ لِي وَلِوَالِدَيَّ وَلِلْمُؤْمِنِينَ يَوْمَ يَقُومُ الْحِسَابُ  http://7asnh.com 
2017-03-12 12:25:07,Are Google's search results getting worse?  http://seekingalpha.com/news/3250505-googles-search-results-getting-worse?source=feed_f … $GOOG $GOOGL
2017-03-12 12:20:26,اللهم قني عذابك يوم تبعث عبادك ♻️  http://zad-muslim.com 
2017-03-12 12:17:31,أذكار الأذان:اللهم رب هذه الدعوة التامة والصلاة القائم  http://ghared.com 
2017-03-12 12:01:59,Alphabets Moonshot Projects Are Starting to Crater #Google $GOOGL  http://wlst.com   http://fortune.com/2017/03/12/alphabet-google-moonshot-projects … pic.twitter.com/OLBRXzHEDe
2017-03-12 12:01:57,Alphabet’s Moonshots Are Starting to Crater - FORTUNE. $GOOGL #Google https://apple.news/A5vgY5s_eQoet5rBEXi9NfQ …
2017-03-12 11:59:04,googl/5sLc89  #OpKillingBay #ALieToldOftenEnoughBecomesTheTruth
2017-03-12 11:51:36,أستغفر الله الذى لاإله إلا هو الحى القيوم وأتوب إليه  http://7asnat.com/ 
2017-03-12 11:50:08,Carriage House Rebuilt Info On Private Lending --> googl./Xv71GG  http://ow.ly/8fFH309MLmQ  #business #wealth #banking #investment #realestate pic.twitter.com/A16gg1Qn5U
2017-03-12 11:48:29,اللهم لك الحمد حتى ترضى و لك الحمد اذا رضيت و لك الحمد بعد الرضا  http://d3waapp.org/ 
2017-03-12 11:45:09,Alphabet’s (GOOGL) “Overweight” Rating Reaffirmed at Morgan Stanley -  http://ln.is/sleekmoney.com/alpha/pVoJl …
2017-03-12 11:43:15,googl
2017-03-12 11:43:08,اللهم اهدني فيمن هديت وعافني فيمن عافيت وتولني فيمن توليت  http://du3a.org 
2017-03-12 11:41:53,الحمد لله لا إله إلا الله وحده لا شريك له له الملك وله الحمد وهو على كل شيء قدير  http://du3a.org 
2017-03-12 11:41:30,اللهم إني أعوذ بك من الهم والحزن والعجز والكسل والبخل والجبن وغلبة الدين وقهر الرجال ♻️  http://zad-muslim.com 
2017-03-12 11:35:20,"What's up Fam! What do you think of this ""#smartjacket"" by Levi's and Google? #wearabletech #ProjectJacquard #Googl…  http://buff.ly/2lQFvtB "
2017-03-12 11:35:04,اللهم أعني على ذكرك و شكرك و حسن عبادتك  http://d3waapp.org/ 
2017-03-12 11:29:06, http://bit.ly/2fry3Bj   This newsletter provides resources needed to get started with penny stocks  $YMC $CM $NKE $GOOGL
2017-03-12 11:27:17,يا حي يا قيوم برحمتك أستغيث أصلح لي شأني كُله ولا تَكِلْني إلى نفيس طرفة عين  http://7asnh.com 
2017-03-12 11:26:50,"""اللهم اغفر لي، وارحمني، واهدني، وعافني، وارزقني""  http://7asnh.com "
2017-03-12 11:22:29,FREE DAILY OPTION TRADE. Sign up for our DAILY FREE TRADE at  http://ExactOptionPicks.com  $AAPL $NFLX $AMZN $GOOGL $DIS $BA $FB $NVDA $PCLN
2017-03-12 11:16:47,﷽ ﴿لا يستطيعون نصرهم وهم لهم جند محضرون﴾ ⬅️  http://du3a.org 
2017-03-12 11:09:08,"Protip: Když o někom napíšete, že je špičkový v online prostředí, ale Googl ho neumí najít ani za deset minut. Pak bych možná vážil slov."
2017-03-12 11:03:35,اللهم اهدني فيمن هديت وعافني فيمن عافيت وتولني فيمن توليت  http://ghared.com 
2017-03-12 10:50:59,سبحان الله وبحمده عدد خلقه ورضا نفسه وزنة عرشه ومداد كلماته  http://du3a.org 
2017-03-12 10:50:45,لا إله إلا أنت سبحانك إني كنت من الظالمين  http://du3a.org 
2017-03-12 10:50:30,دعاء دخول الخلاء:{بسم الله} اللهُمَّ إنّي أعُوذُ بِكَ مِنَ الخُبْثِ والخبائِثِ  http://7asnat.com/ 
2017-03-12 10:47:21,اللهم يا مقلب القلوب ثبت قلوبنا وقلوب اخواننا على دينك وطاعتك  http://d3waapp.org/ 
2017-03-12 10:35:11,"Ih ka akk becanda:( btw akk gak tau apa itu arti nya, mau pake googl… — loh, tadi km nantang nanya ke aku bisa haha  http://l.ask.fm/igoto/45DKECN75V62DDAUPY6IQO7K6GGS7NA3RT6O3G5RKHV2XYNMYIYNC6KOFNF4ASRQKOYP4EQCJNRH6FIN5U36Y3N7NLRP5BJDXAAQDBCPIR3SEK6PA6MD4JHXTT5O5VDVTCUYAVIDZXKE3F4EICDQURLE72IHT74O23OURUDLTKWI2I47GRDX5XPV2BALT47GRM7YYSYZ …"
2017-03-12 10:26:16,لا إله إلا الله الواحد القهار ربُّ السموات والأرض وما بينهما العزيز الغفار  http://7asnh.com 
2017-03-12 10:26:16,لا إله إلا الله وحده لا شريك له له الملك وله الحمد وهو على كل شيء قدير  http://7asnh.com 
2017-03-12 10:20:46,Airbnb: $1B in Funding Will Delay IPO $AIRBNB $SNAP $AMZN $GOOG $GOOGL $TROW $MS $C $JPM $EXPE $PCLN $PYPL http://bit.ly/2nc00Ry 
2017-03-12 10:20:13,اللهم إني أسألك علماً نافعاً ورزقاً طيباً وعملاً متقبل ♻️  http://zad-muslim.com 
2017-03-12 10:18:53,﷽ ﴿ولقد نجينا بني إسرائيل من العذاب المهين﴾ ⬅️  http://du3a.org 
2017-03-12 10:13:16,سبحان الله وبحمده عدد خلقه ورضا نفسه وزنة عرشه ومداد كلماته  http://ghared.com 
2017-03-12 09:58:19,Monitor your watchlist of assets for tweets - US Tech Giants  http://www.comparespreadbetting.com/compare?name=US%20Tech%20Giants … $AAPL $GOOGL $MSFT $FB
2017-03-12 09:54:55,"Voice: The Next Empire  @themotleyfool $AAPL, $AMZN, $FB, $MSFT, $GOOGL, $NVDA, $BIDU, $DOM, $GOOG, $SHOP, $SNAP https://www.fool.com/investing/2017/03/11/voice-the-next-computing-empire.aspx …"
2017-03-12 09:54:28,download #googl iterate mining #gamer typeface #document highres #oculusrift #curate #mirror
2017-03-12 09:50:55,لا إله إلا الله وحده لا شريك له له الملك وله الحمد يحيي ويميت وهو على كل شئ قدير  http://du3a.org 
2017-03-12 09:49:08,سبحان الله والحمدلله ولا إله إلا الله والله أكبر  http://7asnat.com/ 
2017-03-12 09:47:51,أستغفر الله والحمدلله ولا إله إلا الله والله أكبر  http://du3a.org 
2017-03-12 09:47:24,When Will Airbnb IPO?  https://aff.whotrades.com/t/b/4m63s/  $AMZN $GOOG $EXPE $PCLN $TROW $C $MS $JPM $GOOGL $PYPL pic.twitter.com/pYzZENjSJX
2017-03-12 09:46:07,اللهم إني أعوذ بك من الهم والحزن والعجز والكسل والبخل والجبن وضلع الدين وغلبة الرجال  http://d3waapp.org/ 
2017-03-12 09:30:00,"$GOOGL - GOOGL: Rich valuation, long term uptrend time ran out -  https://www.tradingview.com/chart/GOOGL/hdGf1JCA-GOOGL-Rich-valuation-long-term-uptrend-time-ran-out/ …"
2017-03-12 09:28:46,"GOOGL: Rich valuation, long…  http://dlvr.it/Nc5cvZ  | #Stocks #Forex #Commodities #Trading #Traders Join For FREE  http://tradingview.go2cloud.org/aff_c?offer_id=2&aff_id=2246&url_id=23 … pic.twitter.com/QB681WvCAV"
2017-03-12 09:26:45,"GOOGL: Rich valuation, lon\u2026 $GOOGL  http://www.tradingview.com/chart/GOOGL/hdGf1JCA-GOOGL-Rich-valuation-long-term-uptrend-time-ran-out/ …"
2017-03-12 09:26:44,"GOOGL: Rich valuation, long term uptrend time ran out - $GOOGL chart  http://www.tradingview.com/chart/GOOGL/hdGf1JCA-GOOGL-Rich-valuation-long-term-uptrend-time-ran-out/ …"
2017-03-12 09:20:45,I love the googl translate app  pic.twitter.com/cC1xJR4jPj
2017-03-12 09:19:55,ربِّ أسألك خير ما في هذا اليوم وخير ما بعده  http://ghared.com 
2017-03-12 09:10:09,"Вот мой смартфон ""Facэtl""nokia  Не могу переустановить Googl play и market (удаленные ранеее) для того, что бы поставить программы  pic.twitter.com/RgDruMU9Wm"
2017-03-12 09:06:23,اللهم منزل الكتاب سريع الحساب اهزم الأحزاب ♻️  http://zad-muslim.com 
2017-03-12 09:05:09,Miami Tower Info On Private Lending --> googl./Xv71GG  http://ow.ly/JljO309MKU9  #business #wealth #banking #investment #realestate pic.twitter.com/Wza5GnA8KZ
2017-03-12 08:55:59,FREE DAILY OPTION TRADE. Sign up for our DAILY FREE TRADE at  http://ExactOptionPicks.com  $AAPL $NFLX $AMZN $GOOGL $GS $BIDU $FB $NVDA $PCLN
2017-03-12 08:53:01,﷽﴿أم اتخذوا من دونه أولياء ۖ فالله هو الولي وهو يحيي الموتى وهو على كل شيء قدير﴾  http://du3a.org 
2017-03-12 08:47:52,دعاء دخول المسجد:أعوذ بالله العظيم وبوجهه الكريم وسلطانه القديم من الشيطان الرجيم  http://7asnat.com/ 
