date,tweet
2017-04-15 19:39:00,دعاء الرفع من الركوع:ربنا ولك الحمد حمداً كثيراً طيباً  ♻️  http://zad-muslim.com 
2017-04-15 19:38:13,GMPやGDPについて調べたいんだけど、医薬品製造規制だの、医薬品流通規制ばかりヒットしてくるのは、私が普段そういう検索ばかりしているからですかそうですか。過去の私じゃなくていま何を調べたいのか判断してよGoogl（無理）
2017-04-15 19:30:05, http://stockstream.tv/?v=PITnt-TuP4s  // Individual Stock Analysis 3-20-17 AMGN AMZN GOOGL... // $NUE #trading #investing #stocks pic.twitter.com/3CcTD4mrNZ
2017-04-15 19:17:07,Who created !bangs? It's nonsense. Just search something on @wykop. On Googl u type it with site:. On DDG - !wkp & u finally have​ no result
2017-04-15 18:57:39,【定期】仕事も、恋も、両方頑張りたい……そんなあなたに素敵な恋の物語をお届けします。女性向け恋愛ゲーム『恋愛体質』はGoogl Play、App Store他で配信中！  pic.twitter.com/2cxlzKAJV7  https://youtu.be/TLJ9E-xZM9k 
2017-04-15 18:38:00,Apple moves another step forward with self-driving car efforts  https://seekingalpha.com/news/3257190-apple-moves-another-step-forward-self-driving-car-efforts?source=tweet … $AAPL $GOOG $GOOGL $TSLA
2017-04-15 18:24:50,Facebook In Danger Of Losing Credibility In Its Surrender To Germany  https://seekingalpha.com/article/4062564-facebook-danger-losing-credibility-surrender-germany?source=tweet … $GOOG $TWTR $GOOGL $FB
2017-04-15 17:48:07,Do Public Scandals Have Lasting Impact? $UAL $WFC $TGT $WMT $PEP $SBUX $UBER $GOOG $GOOGL $TWTR $PG $GM $FB $AMZN |  http://bit.ly/2nPSUTJ 
2017-04-15 17:30:12,But why do they compete w/ each other? $GOOGL ’s intent or result of siloing?  https://twitter.com/stanyee/status/853355516805992448 …
2017-04-15 17:06:33,أعوذ بكلمات الله التامات من شر ما خلق ♻️  http://zad-muslim.com 
2017-04-15 17:04:56,FREE DAILY OPTION TRADE. Sign up for our DAILY FREE TRADE at  http://ExactOptionPicks.com  $LULU $UAL $WFM $NFLX $BABA $AMZN $GOOGL $X $BAC $JPM
2017-04-15 17:00:49,"12 fun tricks hidden inside Google Hangouts (GOOG, GOOGL) |  http://buff.ly/2paDI3q  pic.twitter.com/nnhcZU56xa"
2017-04-15 16:53:10,Facebook In Danger Of Losing Credibility In Its Surrender To Germany $GOOG #GOOGLE $TWTR $GOOGL…  http://dlvr.it/NvF01W  #Investing #Stocks pic.twitter.com/l5yReYSUXZ
2017-04-15 16:49:31,Facebook In Danger Of Losing Credibility In Its Surrender To Germany  https://seekingalpha.com/article/4062564-facebook-danger-losing-credibility-surrender-germany?source=feed_f … $GOOG #GOOGLE $TWTR $GOOGL $FB
2017-04-15 16:36:20,"Access curated tweets- high relevancy, less spam - US Tech Giants  http://www.comparespreadbetting.com/compare?name=US%20Tech%20Giants … $AAPL $GOOGL $MSFT $FB"
2017-04-15 16:26:14,Come join the elite! We are offering our limited lifetime EMERALD membership again  http://ascendtrading.net/signup/  $IMNP $CLNT $SNAP $AMZN $GOOGL  pic.twitter.com/VLwe2z3vfh
2017-04-15 16:24:37,FREE DAILY OPTION TRADE. Sign up for our DAILY FREE TRADE at  http://ExactOptionPicks.com  $LULU $UAL $WFM $NFLX $BABA $AMZN $GOOGL $C $BAC $JPM
2017-04-15 16:17:38,Oligarchic winner-take-all path paved by $GOOGL $FB $AMZN is a bigger threat than anything coming from #Trump  Mega-Job-Loss not discussed
2017-04-15 16:06:06,googl/1QePoI  #OpKillingBay #ALieToldOftenEnoughBecomesTheTruth
2017-04-15 16:05:25,#Alphabet $GOOGL  MONTHLY Price Pattern Coordinates Chart Monthly Time Price 6UA 4DA Area 6/0 Negative Events 1DAX 2DAX 3DAX 4DAX  pic.twitter.com/7JEtwrOIlC
2017-04-15 16:03:38,Why Your #Business Needs Local #SEO?  #InboundMarketing #SEM #ContentMarketing #SocialMedia #Marketing #SMM #Googl…  https://twitter.com/i/web/status/853337422050054145 …
2017-04-15 16:01:25,Why Your #Business Needs Local #SEO?  #InboundMarketing #SEM #ContentMarketing #SocialMedia #Marketing #SMM #Googl…  https://twitter.com/i/web/status/853337422050054145 …
2017-04-15 16:00:19,$EURUSD:1.06  $EURGBP:0.85 $AAPL: 141.1$ (-0.53%)  $GOOGL: 840.2$ (-0.15%) S&P500: 2328.95(-0.68%)
2017-04-15 15:57:15,"今，北朝鮮の，あのご立派な高層ビル群が，正に映画のセットだったという噂がある。  https://www.google.co.jp/maps/@38.9770406,125.7208513,1529m/data=!3m1!1e3 …  日本の記者達は，googl mapで真偽を確認できるかな？googl mapを操作できるなら，是非チャレンジを！ そういえば，父親が映画制作好きだった"
2017-04-15 15:55:00,"Koch Industries Inc. Invests $227,000 in Alphabet Inc (GOOGL)  http://bit.ly/2phITP0 "
2017-04-15 15:51:25,RT GoogleExpertUK: RT GoogleExpertUK: debbie_adef AuthorViviana chronosstudeos ofuchinyeluAgbu Great article Debbie! I don't work for Googl…
2017-04-15 15:51:00,يا حي يا قيوم برحمتك أستغيث أصلح لي شأني كُله  ♻️  http://zad-muslim.com 
2017-04-15 15:48:09,Alphabet Inc (NASDAQ:GOOGL) Adds A Tweak To Its Image Search To Help You Stay Stylish  http://ln.is/dlvr.it/ljRq8  Herschberg RT
2017-04-15 15:45:49,GOOGL - Alphabet Inc (NASDAQ:GOOGL) Adds A Tweak To Its Image Search To Help You Stay ...  http://ow.ly/GOWq50aS4Fi 
2017-04-15 15:40:39,Alphabet Inc (NASDAQ:GOOGL) Adds A Tweak To Its Image Search To Help You Stay Stylish  http://dlvr.it/NvD4Vw 
2017-04-15 15:27:03,Ok. Jeg googl lidt og fandt heller ik noget. Fandt denne artikel om hvor dele kommer fra. Kun accelerometer fra GER.  http://www.macworld.co.uk/feature/apple/where-are-apple-products-made-how-much-does-iphone-cost-make-india-3633832/ …
2017-04-15 15:07:58,Apple moves another step forward with self-driving car efforts $AAPL $GOOG $GOOGL $TSLA $UBER $GM http://www.seekingalpha.com/news/3257190 
2017-04-15 15:03:15,#Alphabet $GOOGL WEEKLY Price Pattern Coordinates Chart Weekly Time Price 6UA 5DA Area 6/1 near 13-wk ema {green} Negative Events 2MDX 5DAX  pic.twitter.com/Q3xxctnDcQ
2017-04-15 14:55:24,"THE ANDROID MESSAGING EVOLUTION: How #Google is responding to #messagingapp dominance (GOOG, GOOGL)  http://buff.ly/2pCYbtX  pic.twitter.com/slVTDMzXxv"
2017-04-15 14:47:04,Alphabet Inc (NASDAQ:GOOGL) Adds A Tweak To Its Image Search To Help You Stay Stylish  http://dlvr.it/NvCKlX 
2017-04-15 14:46:35,Alphabet Inc (NASDAQ:GOOGL) Adds A Tweak To Its Image Search To Help You Stay Stylish  http://dlvr.it/NvCKST 
2017-04-15 14:24:52,اللهم إني أعوذ بك من الهم والحزن والعجز والكسل والبخل والجبن وغلبة الدين وقهر الرجال ♻️  http://zad-muslim.com 
2017-04-15 14:24:41,This weeks Open Interest Analysis & Strategies $AAPL $AMZN $BIDU $FB $GOOGL $GS $NFLX $TSLA premium post  http://wp.me/p4gJug-2nd  $SPY $SPX
2017-04-15 14:24:31,Can Smartwatches Disrupt The Luxury Watch Market? | $AAPL $GOOG $GOOGL $SSNLF $TOSYY $BBRY $FIT $QCOM $PATEK | http://bit.ly/2oUtDaW 
2017-04-15 14:22:48,The Side Street Journal:   AAPL GOOGL FB INDIA    http://sidestreetjournal.blogspot.com/2016/05/aapl-googl-fb-india.html?spref=tw …
2017-04-15 14:22:17,The World's 3 Most Unshortable Stocks | $AAPL $GOOG $GOOGL $FB $AMZN $CI $ANTM $HUM $UNH $AET $NFLX $MSFT $YHOO |  http://bit.ly/2nALWl2 
2017-04-15 14:21:12,World's Most Valuable Brands By Country $GOOG $GOOGL $SSNLF $TM $STO $STL $RDS.A $RDS.B $RYDAF $EC $NOK $RBC $VOD | http://bit.ly/2oUy5Xk 
2017-04-15 14:15:33,The First To $1 Trillion Is Apple's To Lose | $AAPL $GOOG $GOOGL $MSFT $AMZN $FB $TSLA $BRK.A $BRK.B $XOM | http://bit.ly/2n7oOdN 
2017-04-15 14:14:55,Don’t miss our next FREE OPTION TRADE.  Sign up for our Daily Free Trades at  http://ExactOptionPicks.com  $NVDA $TSLA $GS $NFLX $BAC $GOOGL $FB
2017-04-15 13:45:11,ネットから消され始めた、深田萌絵を応援するBot。  Googlでは出ない情報は、サーグル: http://SAGOOL.jp/ で。 ブログ: http://fukadamoe.blog.fc2.com/  FB: https://www.facebook.com/fukadamoe/ 
2017-04-15 13:39:16,DMV Permit Will Require Apple To Shed Light On Plans Regarding Autonomous…  http://dlvr.it/NvBNXk  #NASDAQ_AAPL #NASDAQ_GOOGL #news #tech pic.twitter.com/OhkPiYCZT8
2017-04-15 13:39:13,Giants Of Cloud Storage  http://dlvr.it/NvBNKz  #NASDAQ_AAPL #NASDAQ_GOOGL #news #tech pic.twitter.com/GyalF3mxdq
2017-04-15 13:25:15,"Good stuff1, Long AAPL ! Apple moves another step forward with self-driving car efforts  https://seekingalpha.com/news/3257190-apple-moves-another-step-forward-self-driving-car-efforts?source=tweet … $AAPL $GOOG $GOOGL $TSLA"
2017-04-15 13:11:37,#تاخر_نتايج_وظايف_وزاره_العدل اللهم يسر للجميع وارزقنا
2017-04-15 13:10:30,#تاخر_نتايج_وظايف_وزاره_العدل الله يرزقنا
2017-04-15 13:00:25,Apple moves another step forward with self-driving car efforts $AAPL $GOOG $GOOGL $TSLA $UBER $GM pic.twitter.com/NEdBfcxUBp
2017-04-15 12:43:51,Please don't!!  Makes more sense for $GOOGL or $MSFT (despite stake in $fb) considering both have struggled with social media platforms
2017-04-15 12:42:50,Keine Sorge ist kein Stream sondern eine Ostereiersuche auf meinem Kanal. Bis MO habt Ihr Zeit. Schau mal den googl Kurzlink
2017-04-15 12:40:23,"Verständnishalber: keine Stream, sondern Ostereiersuche auf meinem Kanal. Siehe googl Kurzlink ;)  https://twitter.com/heikargaming/status/853239817966161921 …"
2017-04-15 12:09:13,"Machine Learning Stocks: 3 Things Investors Should Know @themotleyfool #stocks $IBM, $GOOGL, $INTC, $NVDA, $GOOG https://www.fool.com/investing/2017/04/15/machine-learning-stocks-3-things-investors-should.aspx …"
2017-04-15 11:59:05,googl/5sLc89  #OpKillingBay #ALieToldOftenEnoughBecomesTheTruth
2017-04-15 11:48:12,【アプリ情報】 綾部がアプリに登場だ！ 今日から綾部のプロデューサーにならないか(о´∀`о)  くるたまアプリ AppStore  https://itunes.apple.com/us/app/kurutama/id1169861209?l=ja&ls=1&mt=8 … Googl
2017-04-15 11:47:17,"@evanspiegel some statistics. Let me tell you Snpcht is poorer than Msft, yhoo, googl, amzn, appl, twtr #boycottsnapchat and ur ipo is down"
2017-04-15 11:34:00,$GOOGL 15-day prognosis +0.34%; Alphabet defies expectations with 20 revenue rise  pic.twitter.com/vwjZiNLN7O
2017-04-15 11:31:33,Downward channel/s\u2026 $GOOGL  http://www.tradingview.com/chart/GOOGL/vmAwE2Yj-Downward-channel-symm-triangle-into-ascending-Wedge-support/ … TV_TradingIdeas
2017-04-15 11:28:18,Downward channel/s\u2026 $GOOGL  http://www.tradingview.com/chart/GOOGL/vmAwE2Yj-Downward-channel-symm-triangle-into-ascending-Wedge-support/ …
2017-04-15 11:11:44,$MJNA's Portfolio Company Exhibits Award-Winning CBD Products at A4M Anti-Aging Conference!  http://ln.is/com/zkAs5  $QQQ $S $T $DISH $GOOGL
2017-04-15 11:09:27,"Apple moves another step forward with self-driving car efforts...  https://seekingalpha.com/news/3257190?source=ansh … $AAPL, $GOOG, $GOOGL, $TSLA, $UBER, $GM"
2017-04-15 10:53:10,اللهم أعذنا من عذاب القبر وعذاب جهنم ♻️  http://zad-muslim.com 
2017-04-15 10:38:30,"Saturday links: cheap solar panels, bloated Facebook apps and big beer mergers.  https://abnormalreturns.com/2017/04/15/saturday-links-the-millennial-marriage-bust/ … $F $FB $TAN $UAL $AMZN $GOOGL  pic.twitter.com/ihCNuo5kA1"
2017-04-15 10:22:20,Don't miss our next FREE OPTION TRADE.  Sign up for our Daily Free Trades at  http://ExactOptionPicks.com  $NVDA $TSLA $GS $UAL $BAC $GOOGL $FB
2017-04-15 10:06:55,"Machine Learning Stocks: 3 Things Investors Should Know @themotleyfool #stocks $IBM, $GOOGL, $INTC, $NVDA, $GOOG https://www.fool.com/investing/2017/04/15/machine-learning-stocks-3-things-investors-should.aspx …"
2017-04-15 10:02:15,Googl: and the smaller search enginev put extra importance on the words in your H1 text. (HubSpot)
2017-04-15 09:51:36,Yo ionfiar en ti..... Ni que fueras Googl.!
2017-04-15 09:48:40,Perfect mobile massager now on Google Play !! Super hard vibration !!  https://play.googl #バイブ #バイブレーター #マッサージ
2017-04-15 09:46:52,Archived: Google May Invest Nearly a Billion Dollars In LG Display For Pixel OLED Panels $GOOGL  https://hedgeaccordingly.com/2017/04/google-may-invest-nearly-a-billion-dollars-in-lg-display-for-pixel-oled-panels-googl.html …
2017-04-15 09:42:46,おぉ！ホントだー♪o(≧▽≦)o
2017-04-15 09:35:29,اللهم ارحمنا فإنك بنا راحم ولا تعذبنا فأنت علينا قادر ♻️  http://zad-muslim.com 
2017-04-15 09:35:18,"Apple moves another step forward with self-driving car efforts  https://seekingalpha.com/news/3257190?source=ansh … $AAPL, $GOOG, $GOOGL, $TSLA, $UBER, $GM"
2017-04-15 09:21:24,"Mike Isaac and Nicole Perlroth discuss the week’s technology news, including Burger King’s latest stunt with Googl…  http://ift.tt/2oBGVaT  pic.twitter.com/zNXAKBLKml"
2017-04-15 09:15:35,Alphabet Inc $GOOGL Stake Decreased by Highfields Capital Management LP  http://zpr.io/PDPeW 
2017-04-15 09:07:58,Apple moves another step forward with self-driving car efforts  http://dlvr.it/Nv69Bx  #AAPL #GOOG #GOOGL
2017-04-15 09:01:05,#Options #maxpain chart for $GOOGL. Free options app  http://www.mystockstation.com/  pic.twitter.com/2GmNLRGTzI
2017-04-15 09:00:43,Apple moves another step forward with self-driving car efforts  https://seekingalpha.com/news/3257190-apple-moves-another-step-forward-self-driving-car-efforts?source=feed_f … $AAPL $GOOG $GOOGL $TSLA
2017-04-15 08:45:46,私はあなたとじょいぽりすに行くことを強く望みます(Googl翻訳)
2017-04-15 08:32:43,Alphabet Testing Post-2015 Up Trendline…Again $GOOG $GOOGL  pic.twitter.com/eajMSJ1s44
2017-04-15 08:30:08,Did you miss our review of the #stocks resisting market's #downtrend?  http://chc.li/2oIdCnE  $BABA $AMZN $FB $GOOGL $NFLX $SPX $KBH $TSLA pic.twitter.com/ffqbIrXux1
2017-04-15 08:25:42,$AMZN I would be buying googl instead  http://stocktwits.com/cgf99999/message/80275991 …
2017-04-15 07:27:59,سُبحان اللّهِ وبحمْده .. سُبحان اللّه العظِيم ♡  ♻️  http://zad-muslim.com 
2017-04-15 07:01:37,Mana para penggila film BOKEP ? Nih pasang aplikasi RIBUAN film bokep di  https://googl/lGlCtR Sebarkan ke temen2 yang lain ya!!!
2017-04-15 06:18:36,Monitor your watchlist of assets for tweets - US Tech Giants  http://www.comparespreadbetting.com/compare?name=US%20Tech%20Giants … $AAPL $GOOGL $MSFT $FB
2017-04-15 06:16:09, http://zeustechnologies.com  #advertising #adwords #business #ebusiness #mlm #marketing #payperclick #ppc Best Googl...  http://ow.ly/3cEG50aREvJ 
2017-04-15 06:07:16,"《定期》  ☆ Googl_SNSさん☆ パズドラ・モンスト垢販売の方です(^^)/ ★パズドラ★ ・強垢 ・魔法石多量垢 ・チートワンパン ★モンスト★ ・オーブ多量垢  その他に,,, 「データは売りたいけど、 詐欺には遭いたくない」 というか"
2017-04-15 06:01:13,قد نثرت ياربُ دعائي ، فإرحم اللهم ضعفي ورجائي  وأجب دعوةً في لب قلبي ، وازل يارب همي وشقائي  http://7asnat.com/ 
2017-04-15 06:00:24,ワンクリック詐欺？アプリ誘導？の上を行くにはクリックしてないと自分に言い聞かす。そっ閉じするのが男の決断。 よく見りゃGoogleじゃなくGoogl⬅  pic.twitter.com/PZHvlndsPB
2017-04-15 05:03:45,"Destacado: ""No OK"", Burger King: su nuevo anuncio activa a propósito los dispositivos Googl…  http://bit.ly/2pelSw7  pic.twitter.com/frfir2w4DR"
2017-04-15 04:46:18,اللهم احفظني من بين يديَّ ومن خلفي وعن يميني وعن شمالي  ♻️  http://zad-muslim.com 
2017-04-15 03:57:45,Somewhat Positive Press Coverage Very Unlikely to Effect Alphabet $GOOGL Share Price  http://ift.tt/2oJCueB  #acn
2017-04-15 03:46:13,#emacs calfw-org で予定表を表示する。googl calendar も表示できる。さらに便利。
2017-04-15 03:33:58,googl. google..show me hot anime girls  .
2017-04-15 03:17:09,Googl Doc使いやすいけどなぁ タダやし
2017-04-15 02:24:45,اللهم إني أسألك علماً نافعاً ورزقاً طيباً وعملاً متقبل ♻️  http://zad-muslim.com 
2017-04-15 02:12:26,Technology Tips And Tricks: How to Creating a YouTube channel using your Googl...  http://neelhackers.blogspot.com/2017/04/how-to-creating-youtube-channel-using.html?spref=tw …
2017-04-15 01:28:40,Somewhat Positive Press Coverage Very Unlikely to Effect Alphabet $GOOGL Share Price  http://ift.tt/2p4p9P3 
2017-04-15 01:25:26,اللهم إني أسألك علماً نافعاً ورزقاً طيباً وعملاً متقبل ♻️  http://zad-muslim.com 
2017-04-15 01:05:52,googl
2017-04-15 00:41:30,اللهم إني أسألك علماً نافعاً ورزقاً طيباً وعملاً متقبل  ♻️  http://zad-muslim.com 
2017-04-15 00:30:08,"xataka: Destacado: ""No OK"", Burger King: su nuevo anuncio activa a propósito los dispositivos Googl…  http://bit.ly/2pelSw7 "
2017-04-15 00:09:37,ugh my internet is deciding to do that thing where it only wants to load googl sites
