date,tweet
2018-06-01 14:42:23,valuation in the FANG & Semi stocks is obscene? $NFLX $NVDA $MU $LRCX $AMAT $AMZN $FB $AAPL $GOOG $GOOGL $SOXL $SMH $INTC $AMD
2018-06-01 14:39:16,Waiting For More Boom In Top CAR-T Plays Despite Being YTD Winners Already by @EXPstocktrader  https://seekingalpha.com/p/32rnz  $GILD $NVS $BGNE $SRNE $AAPL $GOOGL $IBB $XBI
2018-06-01 14:38:05,"$AAPL $BABA $COST $GOOGL $TWTR Stocks making the biggest moves premarket: DB, GOOGL, AAPL, BABA, COST, TWTR & more  https://ift.tt/2spSinR "
2018-06-01 14:36:22,Spot on!  🍾 $MSFT $INTC $NVDA $SQ $AAPL $GOOGL $AMZN 🔥 just the prelude esp with earnings around the corner  what say you?
2018-06-01 14:35:55,$GOOGL $MSFT $FB $AMZN
2018-06-01 14:35:03,"#Alphabet $GOOGL  1,132.89 USD  +32.89 (+2.90%) Alphabet's Verily has hired top execs to bring its science research into hospitals and homes  http://dlvr.it/QVtD5v  pic.twitter.com/FRPV0IKgvs"
2018-06-01 14:34:33,who goes home short this market? $amzn $googl $nflx $baba $spx $qqq $vix
2018-06-01 14:27:29,i hope she wont try to search the king outsold up on googl ksjsjs
2018-06-01 14:21:40,"DB, GOOGL, AAPL, BABA, COST, TWTR & more -  https://is.gd/JDwE5E  #VIXC #LatestComments"
2018-06-01 14:20:40,$BVTK Series E Preferred Stock Filed in CO on 5/31 = BOOM TIME. RM into DPT(K) just got that much more real.  Epic Squeeze coming soon IMO. $GOOGL
2018-06-01 14:18:15,$GOOG $GOOGL Alphabet's Verily has hired top execs to bring its science research into hospitals and homes  https://ift.tt/2Hcm7wI 
2018-06-01 14:17:14, http://42stocks.com  $ABMD $ADSK $AMD $ANET $ATHM $BLUE $BRFS $CLR $DVMT $DXCM $GOOGL $HFC $IDXX $ING $ISRG $KORS $LULU $MOMO $MU $NKTR $NTNX $PRU $STT $TM $TRMB $TWTR $UNP $VMW pic.twitter.com/NaDA1jrUla
2018-06-01 14:15:04,NOW OFFERING 7 Day FREE Trial to  options day trading team Room or $TWTR feed   http://ow.ly/tSBW30kioO6  $SPX $AAPL $NFLX $TSLA $AMZN $GOOGL
2018-06-01 14:13:45,"So #YouTube TV? C’mon. Even with $GOOGL’s top-notch leadership, seems unlikely that this will be a success."
2018-06-01 14:09:33,Great stuff. Any thoughts on $SPOT as a takeover target? What would it gain by living within $GOOGL/$AMZN?
2018-06-01 14:06:20,-750 on $BABA -1200 almost on $googl -900 on $mcd calls ... yet still ended almost +2k for the week 😅😅 winners = $mu puts $tsla calls $ibm puts $etsy Calls $twtr calls $nvda Calls $fb Calls ... 😅😅😅
2018-06-01 14:05:27,$GOOGL Liberty National  | 871.93 % return |   https://stockhoot.com/ExtServiceInfo.aspx?Id=0daa95a0-8c85-4938-8965-2219439f9a97 …
2018-06-01 14:04:15,$BTC $spx $nasdaq $ftse $dax $cac $djia $c $XOM $amzn $googl $AVGO $AAPL $WFM $cvs $bac $WMT $COST $WFC $jnj $GE $GS $tsla $fb $JPM $dis $MCD $mo $NKE $TGT $RHT $V #bitcoin $BA $MU $NVDA $BABA $MSFT $TSLA $GLD $QCOM $NFLX $TIF $KO $WADy $AAPL #AAPl  تم تحقيق 4777% pic.twitter.com/NQNGoChnV6
2018-06-01 14:01:03,$GOOGL - Statement of Changes in Beneficial Ownership (4)  http://ih.advfn.com/p.php?pid=nmona&article=77575615&adw=1126416 …
2018-06-01 14:00:42,"Morgan Stanley figured out how much YouTube would be worth if it were a separate company, and it's more valuable than Disney (GOOG, GOOGL) #marketing  https://cmun.it/hhrxnp "
2018-06-01 14:00:41,"Morgan Stanley figured out how much YouTube would be worth if it were a separate company, and it's more valuable than Disney (GOOG, GOOGL) #marketing https://cmun.it/cxpdcks "
2018-06-01 14:00:32,"Morgan Stanley figured out how much YouTube would be worth if it were a separate company, and it's more valuable than Disney (GOOG, GOOGL) #marketing  https://cmun.it/qkmdzr20 "
2018-06-01 13:49:09, http://42stocks.com  $ABMD $AMD $ATHM $BLUE $BRFS $CLR $DVMT $DXCM $GOOGL $HFC $IDXX $ING $ISRG $LULU $MOMO $MU $NKTR $NTNX $PRU $STT $TM $TRMB $TWTR $UNP $VMW pic.twitter.com/wxmONAvM6U
2018-06-01 13:45:05,"1 to 4  trade alerts with 50% to 100% profit potential everyday, try our team  http://ow.ly/LsId30kioO2  $FB $NFLX $AMZN $GOOGL $TSLA $AAPL $GS"
2018-06-01 13:44:04,$GOOGL  https://invst.ly/7mae1 
2018-06-01 13:42:20,Alphabet's Verily has hired top execs to bring its science research into hospitals and homes $GOOGL -  http://hotpagenews.com/r/226954 
2018-06-01 13:41:11,"$GOOGL #Alphabet  for Fri  June 1, VZVOLBO: Buy the Gap Up on the Open 1112 so far, today's H=1138 Upside tgt was 1122 MET  @rg78641 @vxx46 @3Clicksinvest #MoneyInTheBank"
2018-06-01 13:41:01,5️⃣[#Infographie] Les 20 étapes pour être bien classé sur #Mobile par @Googl  https://buff.ly/2kHvhJ3  v/@socialmedia2day #FlashTweet #TransfoNum #mobile #phone #Tips #SEO #Marketing #Digital pic.twitter.com/ijPdH8HnPI
2018-06-01 13:40:47,There is no one like SAM and there is no room like OUR   from yest trades  googl 1110 and 1115  pic.twitter.com/LvqEJCRPPh
2018-06-01 13:38:44,@NYDOUGH_PRO  We had the SPY SPXW GOOGL BABA MSFT NVDA BIIB INTC IQ Most  lined up from 5/16  SPX do you see what i see :}  pic.twitter.com/Wg74LGd23h
2018-06-01 13:36:25,$baba $bidu $nq $qqq $spy $spx $amzn $nvda $goog $googl $avgo  Will post updated charts. Nice consistent profits with optn positions so far with $avgo $goog $googl $baba $bidu #trading #OptionsTrading #charts
2018-06-01 13:34:47,$GOOGL update still moving on nice price action  pic.twitter.com/GhMAJoXlgx
2018-06-01 13:34:03,Great Day $NFLX at ATHs $MSFT > $100 ATH $INTC at 57 ATH $BABA at 204.7 ATH  $AMZN closing in on ATH  $NVDA a laggard $5 below ATH  $GOOGL is the laggard -- needs $60 more to reach year-high  ALL's RIGHT w THE WORLD :)
2018-06-01 13:33:57,$goog $googl  What a hike! Sweet!  https://twitter.com/optionrobai/status/1002439942750928897 …
2018-06-01 13:31:15,These Numbers Paint a Bullish Future for Netflix $NFLX @netflix  http://bit.ly/2H99kLr  $GOOGL $GOOG $AMZN
2018-06-01 13:30:03,"A Geezer$ Alert :  GOOG,GOOGL: Analyst color on Alphabet's Fiat partnership, GDPR risks  https://goo.gl/fb/bWM8XW "
2018-06-01 13:27:27,"""This is not a company with a lack of ambition,"" @califf001, a former FDA commissioner and Verily advisor.. applauding @Google for making big moves and being on top of #GDPR! Great article! @chrissyfarr #DigitalHealth Btw, have you seen $GOOGL today?  https://www.cnbc.com/2018/06/01/alphabets-verily-hires-new-coo-and-president-of-health-platforms.html …"
2018-06-01 13:26:04,"Analyst color on Alphabet's Fiat partnership, GDPR risks $GOOG $GOOGL is winning the driverless race and there’s no close # 2 #investing #trading #technology #TomsTruths https://seekingalpha.com/news/3361161 "
2018-06-01 13:25:00,"As crazy as it sounds, 90% of successful trading is about you. Learn how to do it better! #stocks $AAPL $FB $AMZN $FB $GOOGL  http://bit.ly/2kV2NtG "
2018-06-01 13:17:57,"Analyst color on Alphabet's Fiat partnership, GDPR risks  https://seekingalpha.com/news/3361161-analyst-color-alphabets-fiat-partnership-gdpr-risks?source=feed_f … $GOOG $GOOGL"
2018-06-01 13:17:04, http://42stocks.com  $ABMD $AMD $ATHM $BRFS $CLR $DVMT $DXCM $GOOGL $HFC $IDXX $ING $LULU $MOMO $MU $NKTR $PRU $STT $TM $TRMB $TWTR $UNP $VMW pic.twitter.com/T6IdpWTqxy
2018-06-01 13:17:03,"$GOOGL: 1mRunaway+:4 [+3%,.2%offHi], allTFs+; TLM:2.0; ILM:1.4, goPop:+1.1%, 1MoHi+, DyVol:2.3M:0.6x:1.2x, DyRng:2.3%:0.8x:1.3x"
2018-06-01 13:16:23,F. S. LA VIA DOWNTRED $GOOGL  http://www.tradingview.com/chart/GOOGL/5XBaYMYK-F-S-LA-VIA-DOWNTRED/ …
2018-06-01 13:15:06,"REAL TIME TRADE ALERTS via PRIVATE $TWTR FEED, perfect for people who have FT jobs and trade part-time! $AMZN $NTES $GOOGL $BABA $GS $FB"
2018-06-01 13:09:57,"best Friday in 6 weeks .. GOOGL,BABA calls.... even my wrong order  on GOOG calls came up 4x ..... NDX 1,5% from All time highs .. Thanks"
2018-06-01 13:09:45,$googl trade that we took yesterday  pic.twitter.com/zCvY9iUuW3
2018-06-01 13:09:29,"RT:Everything You Need to Know About Investing in Technology themotleyfool #stocks $AAPL, $AMZN, $MSFT, $INTC, $GOOG, $IBM, $GOOGL #investing #tech #apple #amazon #google #intel #microsoft https://www.fool.com/investing/2018/06/01/everything-you-need-to-know-about-investing-in-tec.aspx …"
2018-06-01 13:08:37,Apple looks to ad growth with new app network $AAPL $FB $GOOG $GOOGL  http://bit.ly/2J7s83S  pic.twitter.com/kmONiJT4WW
2018-06-01 13:07:36,GOOGL and FB still look hella bullish. i'm gona take a couple googl's for next week but only a couple. FB im gonna wait on
2018-06-01 13:06:42,googl  https://twitter.com/GuariumContact/status/1001356282740264962 …
2018-06-01 13:03:34,$BVTK-  Of course!!  Bravatek / DarkPulse emerging conglomerate!!  $AMZN $BA $HON $SBUX $MFST $DIS $ADBE $CRUS $ATV $GOOGL $HD $HAL $T $TV $VZ $GE $NEWR $ADBE $HAS $OKTA $NVDA  https://twitter.com/JasonSF415/status/1002590359275237378 …
2018-06-01 13:03:20,$GOOGL $1145 and then $1180.   Saw and played the run to $1080 this week. #blackboxballers
2018-06-01 13:02:41,"A Geezer$ Alert :  GOOG,GOOGL: Apple looks to ad growth with new app network  https://goo.gl/fb/VZDpcY "
2018-06-01 13:01:04,"Morgan Stanley figured out how much YouTube would be worth if it were a separate company, and it's more valuable than Disney (GOOG, GOOGL) #marketing https://cmun.it/qrxzvnxr "
2018-06-01 13:01:03,"Morgan Stanley figured out how much YouTube would be worth if it were a separate company, and it's more valuable than Disney (GOOG, GOOGL) #marketing  https://cmun.it/p7tafnq8 "
2018-06-01 13:01:02,Today's million dollar CALL #options trade update: $AMZN $FB $FXE $GM $GOOGL $INTC $JPM $KEYS $MU $SPY $TRIP $DIA $F $GOOG $GS $NFLX $TSLA $VKTX ... https://appsto.re/i6hH3LG 
2018-06-01 13:00:58,"Everything You Need to Know About Investing in Technology @themotleyfool #stocks $AAPL, $AMZN, $MSFT, $INTC, $GOOG, $IBM, $GOOGL #investing #tech #apple #amazon #google #intel #microsoft  https://www.fool.com/investing/2018/06/01/everything-you-need-to-know-about-investing-in-tec.aspx …"
2018-06-01 13:00:53,"Morgan Stanley figured out how much YouTube would be worth if it were a separate company, and it's more valuable than Disney (GOOG, GOOGL) #marketing  https://cmun.it/gigyinv "
2018-06-01 13:00:52,"Morgan Stanley figured out how much YouTube would be worth if it were a separate company, and it's more valuable than Disney (GOOG, GOOGL) #marketing https://cmun.it/hid5dy7u "
2018-06-01 13:00:50,"Morgan Stanley figured out how much YouTube would be worth if it were a separate company, and it's more valuable than Disney (GOOG, GOOGL) #marketing  https://cmun.it/bpwho5vs "
2018-06-01 13:00:50,"Morgan Stanley figured out how much YouTube would be worth if it were a separate company, and it's more valuable than Disney (GOOG, GOOGL) #marketing  https://cmun.it/nwb47jg "
2018-06-01 13:00:49,"Morgan Stanley figured out how much YouTube would be worth if it were a separate company, and it's more valuable than Disney (GOOG, GOOGL) #marketing  https://cmun.it/gqmchsoi "
2018-06-01 13:00:49,"Morgan Stanley figured out how much YouTube would be worth if it were a separate company, and it's more valuable than Disney (GOOG, GOOGL) #marketing  https://cmun.it/ayftkwza "
2018-06-01 13:00:47,"Morgan Stanley figured out how much YouTube would be worth if it were a separate company, and it's more valuable than Disney (GOOG, GOOGL) #marketing  https://cmun.it/jkk5qz  - 🚀 Grow your followers with  https://commun.it/growth/?tc=n&aid=content_72 …"
2018-06-01 13:00:46,"Morgan Stanley figured out how much YouTube would be worth if it were a separate company, and it's more valuable than Disney (GOOG, GOOGL) #marketing  https://cmun.it/nffbino  - Learn More  http://cmun.it/i-want-content "
2018-06-01 13:00:45,"Morgan Stanley figured out how much YouTube would be worth if it were a separate company, and it's more valuable than Disney (GOOG, GOOGL) #marketing  https://cmun.it/ijtsoy  (Want this? The easiest way to grow followers for free - It's Magical! 🆓  https://commun.it/?aid=content_69 )"
2018-06-01 13:00:45,"Morgan Stanley figured out how much YouTube would be worth if it were a separate company, and it's more valuable than Disney (GOOG, GOOGL) #marketing  https://cmun.it/33z9tmqr  | Get your content here [Free]:  https://commun.it/grow-your-followers/?tc=c1&aid=content_67&origin=content …"
2018-06-01 13:00:40,"Morgan Stanley figured out how much YouTube would be worth if it were a separate company, and it's more valuable than Disney (GOOG, GOOGL) #marketing  https://cmun.it/7reepr "
2018-06-01 12:56:28,"Apple set to preview new software for phones, tablets, Macs $GOOGL #GOOGL #Technology #Consumerelectronics #Newproductsandservices  http://zpr.io/nL5St "
2018-06-01 12:54:55,What a incredible 2 day move in $GOOGL!!!
2018-06-01 12:48:30,$GOOGL - Apple Looks to Expand Advertising Business With New Network for Apps  http://ih.advfn.com/p.php?pid=nmona&article=77575264&adw=1126416 …
2018-06-01 12:47:35,Apple looks to ad growth with new app network  https://seekingalpha.com/news/3361151-apple-looks-ad-growth-new-app-network?source=feed_f … $GOOG $GOOGL $AAPL $FB
2018-06-01 12:46:58, http://42stocks.com  $ABMD $AMD $ATHM $BRFS $CLR $DVMT $DXCM $GOOGL $HFC $ING $LULU $MOMO $MU $NKTR $PRU $STT $TM $TWTR $UNP $VMW pic.twitter.com/ehtDbo3xmo
2018-06-01 12:40:27,$SNAP $AAPL meets with $SNAP and $pinterest ....  #advertising REVENUE deal  $AAPL to atke on $FB $GOOGL $TWTR pic.twitter.com/8r04eTideL
2018-06-01 12:39:02,One day I’m gonna catch one of these monsters ... but until then I’m going to bitch about the ones I didn’t $GOOGL 🙃😅😥  https://twitter.com/hadjpadjj/status/1002191230464397312 …
2018-06-01 12:34:41,Sam knew on $GOOGL  He always knows.   KING JEFE GOOGLE!
2018-06-01 12:29:10,"$GOOGL will still win this head-to-head market race, so to speak, but credit where credit is due to $MSFT CEO Satya Nadella on a terrific corporate turnaround story. https://twitter.com/businessinsider/status/1001570585791619073 …"
2018-06-01 12:25:39,"Man... that $GOOGL ""king cobra"" pattern turned into a real beauty!!   Too bad, i missed it tho!! lol  pic.twitter.com/RzorUIBCCL"
2018-06-01 12:24:44,$AAPL $GOOGL $FB pic.twitter.com/n8FGIQq3RS
2018-06-01 12:19:35,I have a feeling $MSFT will overtake $GOOGL in market cap. in 2018
2018-06-01 12:18:43,"Great trade by our Notable Trader, @NakamaTrades on $CODX!  Learn more and join FREE at  http://wingtrades.com  $SPY $DJI $DJIA $AMZN $AAPL $MSFT $SPY $DJI $JPM $WFC $BAC $AMZN $AAPL $SQ $MU $SPX $DJI $FB $GOOGL $FB $MSFT $VZ $HD $JPM $BAC $WFC $PM $PG $GE https://twitter.com/NakamaTrades/status/1002584770663022593 …"
2018-06-01 12:16:48, http://42stocks.com  $ATHM $BRFS $CLR $DVMT $DXCM $GOOGL $HFC $ING $LULU $MOMO $MU $NKTR $PRU $STT $TM $TWTR $UNP $VMW pic.twitter.com/cS9Y88ByiC
2018-06-01 12:15:36,"@smartertrader for all doubters and haters out there in tweeter land, you wont believe what SAM did today in just 3 hours of trading all I can say is in 30 years of trading I have never seen anything or anyone like him, day in day out $SPX $GOOGL $BABA"
2018-06-01 12:09:15,Surf Roku Inc Stock for a Safer 275% $ROKU @rokuplayer  http://bit.ly/2LcgaCo  $AAPL $GOOGL $FB pic.twitter.com/EZS66GNkjW
2018-06-01 12:08:38,"Tech Today: Defending Micron, Apple’s Narrative, Can Tesla Make Cars? - Barron's Tech Trader Daily - $MU $TSLA $AAPL $GOOGL $ZUO $WDAY $YEXT $VMW https://www.barrons.com/articles/tech-today-defending-micron-apples-narrative-can-tesla-make-cars-1527868751 …"
2018-06-01 12:07:28,"whatever number you had, add 1 $spx $qqq $amzn $googl $baba"
2018-06-01 12:03:09,$SNAP lost 46% $FB $GOOGL $TWTR gained 15-90%   remeber $SNAP is most popular #SocialMedia among teens in #US and was only one not affected by data breach pic.twitter.com/S8SPF5JWGf
2018-06-01 12:03:02,"$GOOGL: 3mRunaway+:2 [+3%,.2%offHi], allTFs+; TLM:0.7; ILM:0.6, goPop:+1.1%, 1MoHi+, DyVol:2.08M:0.5x:1.1x, DyRng:2.3%:0.8x:1.3x"
2018-06-01 12:02:07,Teens are online constantly. And they’re looking at Snapchat and YouTube. $FB $GOOGL $SNAP - http://hotpagenews.com/r/226941 
2018-06-01 12:00:29,"Morgan Stanley figured out how much YouTube would be worth if it were a separate company, and it's more valuable than Disney (GOOG, GOOGL) #marketing  https://cmun.it/u9ioonbi  - Get your [Free] content here:  https://commun.it/grow-your-followers/?tc=c3&aid=content_40&origin=content …"
2018-06-01 12:00:28,"Morgan Stanley figured out how much YouTube would be worth if it were a separate company, and it's more valuable than Disney (GOOG, GOOGL) #marketing  https://cmun.it/mbut3nmn "
2018-06-01 12:00:28,"Morgan Stanley figured out how much YouTube would be worth if it were a separate company, and it's more valuable than Disney (GOOG, GOOGL) #marketing  https://cmun.it/smepy1 "
2018-06-01 12:00:24,"Morgan Stanley figured out how much YouTube would be worth if it were a separate company, and it's more valuable than Disney (GOOG, GOOGL) #marketing  https://cmun.it/fglilrm  | Get your [Free] content here:  https://commun.it/grow-your-followers/?tc=c1&aid=content_66&origin=content …"
2018-06-01 12:00:24,"Morgan Stanley figured out how much YouTube would be worth if it were a separate company, and it's more valuable than Disney (GOOG, GOOGL) #marketing  https://cmun.it/yqs8b5n0 "
2018-06-01 12:00:22,"Morgan Stanley figured out how much YouTube would be worth if it were a separate company, and it's more valuable than Disney (GOOG, GOOGL) #marketing  https://cmun.it/nbmcb7 "
2018-06-01 12:00:20,"Morgan Stanley figured out how much YouTube would be worth if it were a separate company, and it's more valuable than Disney (GOOG, GOOGL) #marketing  https://cmun.it/nt35ypq9  - content published by  http://cmun.it/quality-content "
2018-06-01 12:00:07,"Popular: $GOOGL, $BRZU, $LPI, $PGNX, $HUYA, $BRFS, $AGLE, $TQQQ, $PBR.A"
2018-06-01 12:00:04,S&P 500 INFORMATION TECHNOLOGY INDEX RISES 1.8% TO RECORD HIGH $AAPL $NFLX $GOOGL $MSFT
2018-06-01 11:59:56,$QQQ #blocks so far sheeze $NVDA $INTC $MSFT $GOOGL what's not working? Most blocks are at the BID (red)  pic.twitter.com/r1FmNUFgju
2018-06-01 11:59:26,Google's military AI drone program may be more lucrative than it said $GOOGL -  http://hotpagenews.com/r/226937 
2018-06-01 11:58:51,Wikimedia says vandals caused Google to display 'Nazism' as GOP ideology $GOOGL -  http://hotpagenews.com/r/226936 
2018-06-01 11:56:41,"We have been busy, last couple days... lots of trades :)  and setups are working out nicely.. $NVDA, $BABA, $AMZN, $ULTA, $GOOGL, $AMD, $INTC, $AAPL, $SPY, $QQQ, added to $MU tgt on $FIVN hit for 100%."
2018-06-01 11:56:06,Waymo and GM just made big moves in the great self-driving-car race $GOOGL $GM - http://hotpagenews.com/r/226932 
2018-06-01 11:56:03,"APPLE, MICROSOFT, ALPHABET AMONG TOP BOOSTS TO S&P 500 INFORMATION TECHNOLOGY INDEX $AAPL $MSFT $GOOGL"
2018-06-01 11:52:41,$googl $goog  getting closer to short signal trigger
2018-06-01 11:49:37,"$BABA i knew it looked good, but its great to see sam saying so.  $NFLX $GOOGL $TWTR $BIDU $NVDA $AMZN $NFLX b/o of bull flag since may 24.  looking rather exponential. https://twitter.com/smartertrader/status/1002574548364156928 …"
2018-06-01 11:47:35,"Missed more than $10K by closing $BABA and $GOOGL yesterday.... I suck. Let's be happy with what I got, still very nice day."
2018-06-01 11:46:57," https://finance.yahoo.com/news/googles-tool-winning-converts-taking-050815737.html … $GOOGL Google's 'Reserve' tool winning converts, taking search to next level via @YahooFinance - ""Google described the volume as significant, with as much as 75 percent of bookings representing new customers."""
2018-06-01 11:46:46, http://42stocks.com  $ATHM $BRFS $DVMT $GOOGL $ING $LULU $MOMO $MU $PRU $STT $TM $TWTR $UNP $VMW pic.twitter.com/b4QFrtCulo
2018-06-01 11:46:36,Oops Chanos better cover!! Model3 Ramp starting soon 5k a week Squeeze $TSLA $GOOGL $AAPL pic.twitter.com/I4ohFwbI6U
2018-06-01 11:39:46,So is $GOOG and $GOOGL to blame?
2018-06-01 11:37:45,#VideoGameConsole Original BOBOVR Z4 mini 3D VR glasses virtual reality googl ...  https://www.gamefundaily24.com/product/original-bobovr-z4-mini-3d-vr-glasses-virtual-reality-google-cardboard-helmet-headset-stereo-bobo-vr-box-for-4-6-mobile-phone/ …
2018-06-01 11:37:01,$AAPL $AMZN $BKNG $FB $GOOGL $NFLX $NVDA $XLNX $ISRG $OAS $WLL $TWTR
2018-06-01 11:36:59,"Facebook is Losing Popularity with Teens #Contests, #Facebook, #Snapchat, #Instagram, $FB, $SNAP, #youtube, #Google, $GOOGL, #Twitter, $TWTR, #smartphone, #incomes, #households, #socialmedia, #MySpace, http://www.financialbuzz.com/facebook-is-losing-popularity-with-teens-1107376 …"
2018-06-01 11:36:13,very busy sorry had  googl 1110 1115  and 1130 for next week loaded in baba     will post later
2018-06-01 11:35:45,Perfect mobile massager now on Google Play !! Super hard vibration !!  https://play.googl #バイブ #バイブレーター #マッサージ
2018-06-01 11:35:31,"Also, why do you think Tim Cook has taken some public swings at Google over the last few months? He knows that the new Android operating system is going to smoke iOS. Apple continues to struggle with innovation. $AAPL $GOOGL"
2018-06-01 11:34:30,bull   $NFLX $BABA $BIDU $TQQQ $GOOGL  https://twitter.com/RobInTheBlack/status/1002573182866542592 …
2018-06-01 11:32:34,"June 1, 2018:  The Day $FANG Saved The Market - The Sequel    $SPY $SPX $FB $GOOGL $GOOG $AMZN $MSFT (100 break) $NFLX $NVDA $BKNG $QQQ pic.twitter.com/zWIUgRvRu7"
2018-06-01 11:31:44,"$GOOGL vs $AAL $GOOGL 7% earning growth, 25 PE, not Berkshire holding $AAL 21% earnings growth 8 PE .92% dividend, Berkshire holding"
2018-06-01 11:31:24,i'm out of all the GOOGL - what a great trade. Waiting for a good dip to re-up farther out   Same FB
2018-06-01 11:31:04,"$NFLX  flag since 5/24 appears to be breaking to upside , now past 356, a rotation from stock to stock moves right along.  $BABA  might get lucky and pull back to touch top of cup. handle from topside, but i would not count on it.  $NVDA $GOOGL $AMZN $TWTR $TQQQ $IWM"
2018-06-01 11:30:51,$QQQ Concentrated =>55% of $QQQ is in top 10 holdings: $AAPL $AMZN $MSFT $FB $GOOG $GOOGL $INTC $CSCO $NVDA $NFLX. http://etfdb.com/etf/QQQ/ 
2018-06-01 11:30:02,"take a look at $GOOGL too, I went long yesterday morning, I am predicting a run at march highs -  https://www.screencast.com/t/dEZMilV2zjyj "
2018-06-01 11:29:22,$IBB is participating with its #bullish chart.   More macro-market timing w/  http://waconomics.org .  $SPY! $VIX $UVXY? $DBA $WMT $AMZN ~ $USO $XLE $GLD ^ ( $GDX $NUGT) / $DUST = $TLT * $BAC $GS / $FB $AAPL $NFLX $GOOGL $TSLA $QQQ #Waconomics #Water pic.twitter.com/G6FvlRW3Kb
2018-06-01 11:28:42,"Stocks making the biggest moves premarket: DB, GOOGL, AAPL, BABA, COST, TWTR & more -  http://cnbc.com/id/105244650 "
2018-06-01 11:24:53,Thanks so much for the $GOOGL calls... Locked all now.  You're the best.
2018-06-01 11:22:47,"One of these days gonna write a book on the exploits and influence social media, the media, internet, etc. has on trading and investing. I shall call it: “Trading Under the Influence.”   $spy $qqq $dia $vix $twtr $fb $googl $nflx $baba $mu"
2018-06-01 11:21:45,June is going to be sweet.  $NFLX $BABA $GOOGL $AMZN $TWTR $NVDA $TQQQ https://twitter.com/option_snipper/status/1002559435213066240 …
2018-06-01 11:19:56,🙃🙃🙃 $GOOGL  https://twitter.com/hadjpadjj/status/1002191230464397312 …
2018-06-01 11:19:52,$NFLX  looks just about ready to break out of its bull flag. $BABA seems to have b/o.   $GOOGL  wow.    $NVDA $IWM $TQQQ $TWTR $QQQ $AMZN
2018-06-01 11:18:26,"$GOOGL $BABA giving me one hell of a day today, simply amazing"
2018-06-01 11:16:45, http://42stocks.com  $ATHM $BRFS $DVMT $GOOGL $ING $LULU $MU $STT $TM $UNP $VMW pic.twitter.com/QopBcLJfQq
2018-06-01 11:16:11,"Se filtra un impactante vídeo interno de Google con sus ideas para controlar el comportamiento humano   https://m.eldiario.es/tecnologia/interno-Google-extraer-intimos-usuarios_0_772723127.amp.html …  Se filtra un impactante vídeo interno de Google con sus ideas para controlar el comportamiento humano  En el documento, Googl…  https://plus.google.com/+JulioPoisotDeMaría/posts/7fD4tQJucqc …"
2018-06-01 11:15:47,Short $GOOGL 1137
2018-06-01 11:14:48,$TWTR marching to new 52-week highs. Initial #tweet & shares taken 11/15/17. More macro-market timing w/  http://waconomics.org .  $SPY! $VIX $UVXY? $DBA $WMT $AMZN ~ $USO $XLE $GLD ^ ( $GDX $NUGT) / $DUST = $TLT * $BAC $GS / $FB $AAPL $NFLX $GOOGL $TSLA $QQQ #Waconomics #Water pic.twitter.com/SdgqTATEdw
2018-06-01 11:12:42,"$GOOGL Big breakout, although currently stretched. Close up here reestablishes the up trend."
2018-06-01 11:10:58,$GOOGL Calls closed for 10.61  https://twitter.com/Dreamestorical/status/999381695550885889 …
2018-06-01 11:10:43,@EyeoftheStormZ are you still holding googl calls? Man I sold way too soon
2018-06-01 11:10:25,GOOGL filled the Gap and surpassed MSFT! Like I predicted yesterday
2018-06-01 11:10:10,sold few moments ago fucking huge win :) congrats to everyone!. $GOOGL
2018-06-01 11:09:11,HUGE day so far in chat lotto friday not dissapointing Gave $BABA $BIDU lottos so so early cashed out $GOOGL total 600% GAIN $NVDA unreal profits! lock gains do not get greedy guys be careful on the swings over weekend too!. I'm done for the day 2nd best week of the year for me!.
2018-06-01 11:08:17,$GOOGL 45 degree angle day  pic.twitter.com/kSVNM4CnSE
2018-06-01 11:08:08,Investors are beginning to wake up and are doing the math on Waymo. Probably worth $100B+. Uber has waived the white flag and Waymo is the clear winner. $GOOGL $GOOG
2018-06-01 11:03:32,"$NYFANG index would be a new closing high here, above the 2770 March high.  FANG $FB $AMZN $NFLX $GOOGL #newhighsarebullish Shown with rel to SPX, already a new relative strength high yesterday Intraday price res at 2790 perhaps pic.twitter.com/WS7RI89zmi"
2018-06-01 11:03:28,$GOOGL Beast mode.. today's flow #StayGreen pic.twitter.com/VgNoYSHgkb
