date,tweet
2017-03-12 08:44:23,اللهم أعني على ذكرك وشكرك وحسن عبادتك  http://d3waapp.org/ 
2017-03-12 08:33:44,الذكر عند الدخول المنزل:بسم الله ولجنا وبسم الله خرجنا وعلى ربنا توكلنا ثم ليسلم على أهله  http://du3a.org 
2017-03-12 08:30:11,Just Pinned to Social Media & Content: Now that our whole district has gone 1:1 with Googl…  http://ift.tt/2mPfMky  pic.twitter.com/x0RGIEE0Sc
2017-03-12 08:27:15,"ربنا عليك توكلنا و اليك انبنا و هاجرنا تقبلنا بعملنا الصالح , و اغفر ذنوبنا   http://d3waapp.org/ "
2017-03-12 08:25:02,أعوذ بكلمات الله التامات من شر ما خلق  http://7asnh.com 
2017-03-12 08:24:36,أذكار الأذان:اللهم رب هذه الدعوة التامة والصلاة القائم ♻️  http://zad-muslim.com 
2017-03-12 08:12:22,NANANAN VICTORIA KERLEY TAPE SUR GOOGL TAPE VITE V ITE
2017-03-12 08:11:20,Perfect mobile massager now on Google Play !! Super hard vibration !!  https://play.googl #バイブ #バイブレーター #マッサージ
2017-03-12 08:06:22,أعوذ بكلمات الله التامات من شر ما خلق  http://ghared.com 
2017-03-12 07:47:37,لا حول ولا قوة إلا بالله لا إله إلا الله ولا نعبد إلا إياه له النعمة وله الفضل وله الثناء الحسن  http://7asnat.com/ 
2017-03-12 07:46:40,ااستغفر اللهِ االعظيم ..بعدد من .. ذكر ۉشكر ! ااستغفر اللهِ االعظيم .. بعدد من صلى ۉكبر ..  http://du3a.org 
2017-03-12 07:43:12,اللهم ارحم موتانا وموتى المسلمين واجعل قبورهم روضة من رياض الجنة  http://d3waapp.org/ 
2017-03-12 07:41:05,﷽ ﴿وأنا لمسنا السماء فوجدناها ملئت حرسا شديدا وشهبا﴾ ⬅️  http://du3a.org 
2017-03-12 07:40:28,#ThankYou for following us. #yourethebest. #AforEffort  http://www.ironbcg.com  $aapl $mck $googl $hpq $hpe $usat #CES2018 #AI
2017-03-12 07:36:47,اللهم أنت عضدي وأنت نصيري بك أجول وبك أصول وبك أُقاتل  http://du3a.org 
2017-03-12 07:35:09,#ThankYou for following us. #yourethebest. #AforEffort  http://www.ironbcg.com  $aapl $mck $googl $hpq $hpe $usat #CES2018 #AI
2017-03-12 07:27:06,حسبي الله لا إله إلا هو عليه توكلت وهو رب العرش العظيم ♻️  http://zad-muslim.com 
2017-03-12 07:26:46,سبحان الله وبحمده سبحان الله العظيم سبحان الله عدد النعم سبحان الله عدد خلقه، ورضى نفسه، وزنة عرشه، ومداد كلماته  http://d3waapp.org/ 
2017-03-12 07:24:59,اللهم اكفني بحلالك عن حرامك وأغنني بفضلك عن سواك  http://7asnh.com 
2017-03-12 07:19:16,"Access curated tweets- high relevancy, less spam - US Tech Giants  http://www.comparespreadbetting.com/compare?name=US%20Tech%20Giants … $AAPL $GOOGL $MSFT $FB"
2017-03-12 07:05:56,Track curated news and tweets for multiple tickers - US Tech Giants  http://www.comparespreadbetting.com/compare?name=US%20Tech%20Giants … $AAPL $GOOGL $MSFT $FB
2017-03-12 06:58:50,Newcastle United's automatic promotion place is under serious threat as rivals make up lost ground https://www.googl…  pic.twitter.com/n5zR9Igk26
2017-03-12 06:54:53,".@NaviAvatar1 on #Periscope: StockNews Dow up 44, $SNAP $GOOGL $AAPL $LABU $FB $TWTR  https://www.pscp.tv/w/a5PO9DF4a1FETndORHlqem18MXZPR3dZWXZCeXZ4QnNQy07nSVsBFlJ0Jxd7QXEGZnyu8MDwV5kurBYRiDH7 …"
2017-03-12 06:54:48,أستغفر الله العظيم وأتوب إليه  http://ghared.com 
2017-03-12 06:52:45,Alphabet Inc $GOOGL is Investec Asset Management LTD’s 9th Largest Position  http://zpr.io/PKVrs 
2017-03-12 06:46:41,اللهم لا سهل إلا ما جعلته سهلا وإذا شئت جعلت الحزن سهلا  http://7asnat.com/ 
2017-03-12 06:42:16,قد نثرت ياربُ دعائي ، فإرحم اللهم ضعفي ورجائي  وأجب دعوةً في لب قلبي ، وازل يارب همي وشقائي  http://d3waapp.org/ 
2017-03-12 06:38:36,اللهم منزل الكتاب سريع الحساب اهزم الأحزاب  http://du3a.org 
2017-03-12 06:37:36,﷽ ﴿أإذا متنا وكنا ترابا وعظاما أإنا لمبعوثون﴾ ⬅️  http://du3a.org 
2017-03-12 06:33:01,$GOOGL Swing trade going well. In at 848.96 trading at 861.41. #swingtrading #stocks https://twitter.com/CompoundTrading/status/840872887514943488 …
2017-03-12 06:31:33,$GOOGL Swing trade going well. In at 848.96 trading at 861.41. #swingtrading #stocks pic.twitter.com/5nHuAOSxn7
2017-03-12 06:23:56,لا إله إلا الله وحده لا شريك له له الملك وله الحمد وهو على كل شيء قدير  http://7asnh.com 
2017-03-12 06:23:28,ربي اغفر لي ذنبي  http://d3waapp.org/ 
2017-03-12 06:19:31,اللهم لا سهل إلا ما جعلته سهلاً وأنت تجعل الحزن إذا شئت سهلا  http://ghared.com 
2017-03-12 06:07:00,"《定期》  ☆ Googl_SNSさん☆ パズドラ・モンスト垢販売の方です(^^)/ ★パズドラ★ ・強垢 ・魔法石多量垢 ・チートワンパン ★モンスト★ ・オーブ多量垢  その他に,,, 「データは売りたいけど、 詐欺には遭いたくない」 というか"
2017-03-12 06:03:31,ブチギレてる人いるけどgooglとかbitly踏む時点で…
2017-03-12 06:00:26,Hoe Google Places aanmaken + belangrijke reviews verzamelen? Hoe je Google Business account aanmaken (Googl  http://rviv.ly/sON7F  #jasseo
2017-03-12 05:52:11,اللهم منزل الكتاب سريع الحساب اهزم الأحزاب اللهم اهزمهم وزلزلهم  http://du3a.org 
2017-03-12 05:49:42,Okay googl How do I tell if someone is flirting w me or if they're just being a cool friend I re
2017-03-12 05:47:51,googl #email #project privacy #gamer #appl widget #wikipedia #scrollbar filezilla
2017-03-12 05:45:39,الحَمْدُ لله الذِي أحْيَانا بَعْدَمَا أمَاتَنَا وإلَيْهِ النَشُور   http://7asnat.com/ 
2017-03-12 05:41:16,أصبحنا وأصبح الملك لله رب العالمين  http://d3waapp.org/ 
2017-03-12 05:38:25,لا إله إلا الله وحده لا شريك له له الملك وله الحمد وهو على كل شئ قدير  http://du3a.org 
2017-03-12 05:23:51,اللهم إنا نسألك زيادة في الأيمان وبركة في العمر وصحة في الجسد وسعة في الرزق  http://d3waapp.org/ 
2017-03-12 05:22:41,اللهم احفظني من بين يديَّ ومن خلفي وعن يميني وعن شمالي ومن فوقي وأعوذ بعظمتك أن أغتال من تحتي  http://7asnh.com 
2017-03-12 05:22:41,اللهم أنت ربي لا إله إلا أنت خَلَقتني وأنا عَبْدُك وأنا على عهدك ووعدك ما استطعت وأعوذ بك من شر ما صنعت  http://7asnh.com 
2017-03-12 04:53:35,لا إله إلا أنت سبحانك إني كنت من الظالمين  ♻️  http://zad-muslim.com 
2017-03-12 04:49:45,Настроение: не активничать в твите с 2к16
2017-03-12 04:45:34,اللهم أعني على ذكرك وشكرك وحسن عبادتك  http://du3a.org 
2017-03-12 04:44:29,اللهم أنت السلام ومنك السلام تباركت يا ذا الجلال والإكرام  http://7asnat.com/ 
2017-03-12 04:40:36,أذكار_الصباح - لا إله إلا الله وحده لا شريك له ،له الملك وله الحمد وهو على كل شيء قدير(مائة مرة إذا أصبح )  http://d3waapp.org/ 
2017-03-12 04:38:58,﷽ ﴿والذين إذا أنفقوا لم يسرفوا ولم يقتروا وكان بين ذلك قواما﴾ ⬅️  http://du3a.org 
2017-03-12 04:31:50,اللهم أكرمنا بقرب لك لا نرتد بعده، وعتق يغشانا برحمة منك ويقينا عذابك  http://du3a.org 
2017-03-12 04:30:51,Tu ressembles à cette dominatrice  https://www.googl... — Ca me degoute ee srx si cest pour poser des questio...  https://curiouscat.me/jokiceee/post/118249824?t=1489307451 …
2017-03-12 04:24:49,cn we googl tht ??
2017-03-12 04:22:20,يارب إن عائلتي هي من أجمل هداياك ومن أغلى مارزقتني فاحفظهم لي وأسعدهم  http://d3waapp.org/ 
2017-03-12 04:21:47,اللهم إني أعوذ برضاك من سخطك وأعوذ بمعافاتك من عقوبتك وأعوذ بك منك لا أحصي ثناء عليك أنت كما أثنيت على نفسك  http://7asnh.com 
2017-03-12 04:09:51,HAPPY world day against cyber censorship march 12 (regards from SLOVENIA - MSGA) Sources:Googl  http://www.empowr.com/alesicepic?p=BTVHZ … pic.twitter.com/4J8sKSAED4
2017-03-12 04:06:59,HAPPY world day against cyber censorship march 12 (regards from SLOVENIA - MSGA) Sources:Googl  http://www.empowr.com/alesicepic?p=BTVHR … pic.twitter.com/SDeWFgZva3
2017-03-12 04:04:19,HAPPY world day against cyber censorship march 12 (regards from SLOVENIA - MSGA) Sources:Googl  http://www.empowr.com/alesicepic?p=BTVHH … pic.twitter.com/w9UxjlzZwB
2017-03-12 03:54:19,﷽ ﴿ولا تحزن عليهم ولا تكن في ضيق مما يمكرون﴾ ⬅️  http://du3a.org 
2017-03-12 03:53:49,أذكار الأذان:يدعو لنفسه بين الأذان والإقامة فإن الدعاء  http://ghared.com 
2017-03-12 03:43:16,أعيذك بكلمات الله التامة من كل شيطان وهامة وكل عينِ لامة  http://7asnat.com/ 
2017-03-12 03:42:02,اللهم رحمتك أرجو فلا تكلني إلى نفسي طرفة عين ِ وأصلح لي شأني كله لا إله إلا أنت  http://du3a.org 
2017-03-12 03:39:39,اللهم لا تسلط علينا بذنوبنا من لا يخافك فينا ولا يرحمنا  http://d3waapp.org/ 
2017-03-12 03:24:27,اللهم قني عذابك يوم تبعث عبادك ♻️  http://zad-muslim.com 
2017-03-12 03:23:24,ربي أعوذ بك من الكسل وسوء الكبر   http://du3a.org 
2017-03-12 03:21:24,اللهم إني أعوذ بك من الهم والحزن والعجز والكسل والبخل والجبن وضلع الدين وغلبة الرجال  http://7asnh.com 
2017-03-12 03:21:23,حسبنا الله ونعم الوكيل  http://7asnh.com 
2017-03-12 03:20:54,سبحان الله وبحمده أستغفر الله وأتوب إليه.  http://d3waapp.org/ 
2017-03-12 03:06:47,$AIRBNB $SNAP $EXPE $PCLN $C $JPM $MS $AMZN $GOOG $GOOGL $TROW #investing #stocks #finance #bonds #realestate #ai... http://stocktwits.com/vazoof/message/77019602 …
2017-03-12 01:47:40,When Will Airbnb IPO? $AIRBNB $SNAP $EXPE $PCLN $C $JPM $MS $AMZN $GOOG $GOOGL $TROW  http://bit.ly/2nc00Ry  pic.twitter.com/jke8yaF5Of
2017-03-12 01:45:38,اللهم قني عذابك يوم تبعث عبادك  http://du3a.org 
2017-03-12 01:42:28,غارقون في نِعمك يا الله ˛ فلك الحمدُ حتى ترضىَ  http://7asnat.com/ 
2017-03-12 01:38:21,اللهم لك الحمد كما تحب وترضى  http://d3waapp.org/ 
2017-03-12 01:35:37,﷽ ﴿إن الذين كفروا وصدوا عن سبيل الله ثم ماتوا وهم كفار فلن يغفر الله لهم﴾ ⬅️  http://du3a.org 
2017-03-12 01:22:28,#catpcha #email iterate privacy #googl typeface #mint #page #oculusrift filezilla
2017-03-12 01:20:45,ربنا اغفر لنا ذنوبنا وكفر عنا سيئاتنا وتوفنا مع الأبرار  http://7asnh.com 
2017-03-12 01:19:38,اللهم قني عذابك يوم تبعث عبادك  http://d3waapp.org/ 
2017-03-12 01:11:27,Read your blog posts out loud to make sure your writing is polished. (Googl  Webmastersj
2017-03-12 01:01:52,بسم الله الذي لا يضرُّ مع اسمه شيء في الأرض ولا في السماء وهو السميع العليم  http://du3a.org 
2017-03-12 01:00:59,Mana para penggila film BOKEP ? Nih pasang aplikasi RIBUAN film bokep di  https://googl/lGlCtR Sebarkan ke temen2 yang lain ya!!!
2017-03-12 00:59:30, http://ift.tt/2mVyCH5  [Apps] [Games] Lost Grimoires Full - On Sale for 2 days ($3.99 down from $6.99 CDN) #googl…  pic.twitter.com/tcD8r1DXCk
2017-03-12 00:52:34,سبحان الله وبحمده سبحان الله العظيم  http://du3a.org 
2017-03-12 00:50:41,Snap: When The Bubble Burst  http://seekingalpha.com/article/4052729-snap-bubble-burst?source=tweet … $GOOG $GOOGL $TWTR $UA $UAA $SNAP
2017-03-12 00:41:37,اللهم آجرني من موت الغفله ولآ تآخذني من الدنيا إلا وانت رآضٍ عني  http://7asnat.com/ 
2017-03-12 00:41:11,﷽ ﴿اتخذوا أيمانهم جنة فصدوا عن سبيل الله فلهم عذاب مهين﴾ ⬅️  http://du3a.org 
2017-03-12 00:37:23,اللهم اغفر للمسلمين والمسلمات والمؤمنين والمؤمنات الأحياء منهم والأموات  http://d3waapp.org/ 
2017-03-12 00:35:19,اللهم أعذنا من عذاب القبر وعذاب جهنم ♻️  http://zad-muslim.com 
2017-03-12 00:29:26,Long $googl
2017-03-12 00:27:28,I think $aapl will drop iOS and switch to Android to remain relevant in hardware #ios #android $googl #tech
2017-03-12 00:26:15,なにがおもしろいってgooglのショートリンクってことだよね
2017-03-12 00:24:11,"A bad user experien.e can hurt your site's ranking on search results. (Googl, Webmasters)"
2017-03-12 00:19:46,اللهم خَلَقْتَ نفسي وأنت توفَّاها لك مماتها ومَحْياها إن أحييتها فاحفظها وإن أمتها فاغفر لها اللهم إني أسألك العافية  http://7asnh.com 
2017-03-12 00:19:45,اللهم إني أسألك الجنة وأعوذ بك من النار  http://7asnh.com 
2017-03-12 00:19:26,اللهم اغفر لي وارحمني والحقني بالرفيق الأعلى  http://d3waapp.org/ 
2017-03-12 00:09:52,ネットから消され始めた、深田萌絵を応援するBot。  Googlでは出ない情報は、サーグル: http://SAGOOL.jp/ で。 ブログ: http://fukadamoe.blog.fc2.com/  FB: https://www.facebook.com/fukadamoe/ 
2017-03-12 00:09:03,الذكر عند الخروج من المنزل:بسم الله توكَّلْتُ على الله  http://ghared.com 
