date,tweet
2018-06-01 19:50:50,$AAPL #APPLE $APTV $AUDVF $BABA $BCCMY $BIDU $BMWYY $BYDDF $BYDDY $DDAIF $F $FCAU $FUJHY $GELYY $GM $GOOG $GOOGL  https://seekingalpha.com/article/4178959-ev-company-news-month-may-2018?source=feed_f …
2018-06-01 19:43:50,$GOOGL 08-Jun-18 ATM Implied Vol Retreats -10.3% to 17.1. Straddle Implies a Move of ±1.9%  https://marketchameleon.com/Overview/GOOGL/OptionSummary/ …
2018-06-01 19:41:48,"Once $GOOGL breaks the downtrend look to $1198 ATH test, then $1280, $1306, $1330, $1372  pic.twitter.com/NGKAb2eUvH"
2018-06-01 19:41:30,Also bad news for $GOOGL shareholders as it makes things tougher for google to diversify out of the search engine business.
2018-06-01 19:31:18,Check out today's profit analysis on $DDE  Learn more and join FREE at  http://wingtrades.com  $SPY $DJI $DJIA $AMZN $AAPL $MSFT $SPY $DJI $JPM $WFC $BAC $AMZN $AAPL $SQ $MU $SPX $DJI $FB $GOOGL $FB $MSFT $VZ $HD $JPM $BAC $WFC $PM $PG $GE $GLD $MU $IQ $DRYS $BTC $ETH $LTC pic.twitter.com/rZJdcCJuxy
2018-06-01 19:30:08,ACTIVE TRADERS Try one of these FREE trading guides:   http://ow.ly/hD1y30kip0N  $NFLX $TSLA $AAPL $TWTR $GS $FB $AMZN $GOOGL $NVDA
2018-06-01 19:29:03,"Top Performing Stocks In May  https://seekingalpha.com/article/4178933?source=ansh … $AAPL, $ESND, $NANO, $PES, $FB, $GOOG, $GOOGL  pic.twitter.com/KVl3LJWanD"
2018-06-01 19:28:54,$GOOG $GOOGL $SAN Google plans not to renew military deal protested by employees: source https://ift.tt/2LS9Cd9 
2018-06-01 19:26:34,In like $GOOGL finished the last 5min of trade!!
2018-06-01 19:26:29,$GOOGL those suicide calls killed it..go bulls  pic.twitter.com/Oy9urIhF4P
2018-06-01 19:24:13,3 Large-Cap Stocks Set for Monster Growth  http://bit.ly/2snUyw4  $BABA $FB $GOOGL
2018-06-01 19:15:03,"REAL TIME TRADE ALERTS via PRIVATE $TWTR FEED, perfect for people who have FT jobs and trade part-time! $AMZN $NFLX $GOOGL $WIX $GS $FB"
2018-06-01 19:11:12,"$LULU weekly options that expires today; $119 6/1 Calls ran from .34 to $4.70.  $3,400 to $47,000.   http://bit.ly/2q2awKg . $BIDU hit target.  $TSLA hit target.  $GOOGL, $NVDA $AAPL all hit targets today."
2018-06-01 19:09:01,"Money Matters: After a dozen employees quit in protest, Google has reportedly decided not to renew its contract for military drone initiative Project Maven (GOOG, GOOGL)  http://dlvr.it/QVvGMw "
2018-06-01 19:07:16,"Uber CEO Dara Khosrowshahi speaks on repairing burned bridges left behind by Travis Kalanick, reveals he's talking to Waymo about joining Uber's network (GOOGL, GOOG)  http://dlvr.it/QVvGJ5  pic.twitter.com/tyq0sIRBTB"
2018-06-01 19:05:40,"If you only watch one video showing the new @KopinGoldeni Infinity launched at #AWE2018 this week, make it this one starring @marcreece ->  https://m.facebook.com/story.php?story_fbid=1719449558169405&id=1686723111442050&refsrc= http%3A%2F%2Ft.co%2FM3TqZVMHw2&_rdr … $KOPN just chnaged the game for Enterprise #AR #smartglasses adoption. $VUZI $GOOGL $HIMX pic.twitter.com/1fvWHBsxyv"
2018-06-01 19:01:20,"How Google is responding to messaging app dominance (GOOG, GOOGL)  http://www.moneyhealthfinance.com/how-google-is-responding-to-messaging-app-dominance-goog-googl-2/ … pic.twitter.com/O2ex7m97V6"
2018-06-01 19:00:40,"Morgan Stanley figured out how much YouTube would be worth if it were a separate company, and it's more valuable than Disney (GOOG, GOOGL) #marketing  https://cmun.it/yzncfl17 "
2018-06-01 19:00:40,"Morgan Stanley figured out how much YouTube would be worth if it were a separate company, and it's more valuable than Disney (GOOG, GOOGL) #marketing  https://cmun.it/9vhpmts  - Get your [Free] content here:  https://commun.it/grow-your-followers/?tc=c1&aid=content_37&origin=content … via @commun_it"
2018-06-01 19:00:40,"Morgan Stanley figured out how much YouTube would be worth if it were a separate company, and it's more valuable than Disney (GOOG, GOOGL) #marketing  https://cmun.it/ozxtemh "
2018-06-01 19:00:40,"Morgan Stanley figured out how much YouTube would be worth if it were a separate company, and it's more valuable than Disney (GOOG, GOOGL) #marketing https://cmun.it/5fmsq5f "
2018-06-01 19:00:39,"Morgan Stanley figured out how much YouTube would be worth if it were a separate company, and it's more valuable than Disney (GOOG, GOOGL) #marketing  https://cmun.it/jwicx5g  - Get your [Free] content here:  https://commun.it/grow-your-followers/?tc=n&aid=content_47&origin=content …."
2018-06-01 19:00:38,"Morgan Stanley figured out how much YouTube would be worth if it were a separate company, and it's more valuable than Disney (GOOG, GOOGL) #marketing  https://cmun.it/l2qr5uza "
2018-06-01 19:00:38,"Morgan Stanley figured out how much YouTube would be worth if it were a separate company, and it's more valuable than Disney (GOOG, GOOGL) #marketing  https://cmun.it/it7x6fq "
2018-06-01 19:00:35,"Morgan Stanley figured out how much YouTube would be worth if it were a separate company, and it's more valuable than Disney (GOOG, GOOGL) #marketing  https://cmun.it/oepctc  - Get your [Free] content here:  https://commun.it/create-account?first_cid=3394576&tc=s&origin=recu_suffix_ … content_65&aid=content_65"
2018-06-01 19:00:31,"Morgan Stanley figured out how much YouTube would be worth if it were a separate company, and it's more valuable than Disney (GOOG, GOOGL) #marketing  https://cmun.it/2txtwuu  (Want this? The easiest way to grow followers for free - It's Magical! 🆓  http://cmun.it/grow-followers-free …)"
2018-06-01 19:00:31,"Morgan Stanley figured out how much YouTube would be worth if it were a separate company, and it's more valuable than Disney (GOOG, GOOGL) #marketing  https://cmun.it/184jhuj "
2018-06-01 19:00:28,"Morgan Stanley figured out how much YouTube would be worth if it were a separate company, and it's more valuable than Disney (GOOG, GOOGL) #marketing  https://cmun.it/vulnjr24  | Get your [Free] content here:  https://commun.it/grow-your-followers/?tc=c1&aid=content_66&origin=content …"
2018-06-01 18:45:04,NOW OFFERING 7 Day FREE Trial to  options day trading team Room or $TWTR feed   http://ow.ly/NYAs30kioOk  $RH $AAPL $NFLX $TSLA $AMZN $GOOGL
2018-06-01 18:44:28,"Google $GOOGL buyers today of 1,500 June 29th (W) $1,150/$1,200 call spreads for $12.40"
2018-06-01 18:40:42,"Unusual option activity alert: $PBR 9x average daily volume, $PFE 5x, $FXI 5x, $GOOGL 3x, $BIDU 2x, $MU 2x, $TWTR 2x"
2018-06-01 18:35:09,Tech Review: 1) Internet Trends 2018 - What Mary Meeker @kpcb Missed 2) Most Hyperscale Data Centers are Operating in the U.S  http://www.domainmondo.com/2018/06/tech-review-internet-trends-2018-what.html … #Google $GOOG $GOOGL $AMZN $FB #tech #investing #monopoly #GDPR #Cybersecurity #dataprocessing #PersonalData pic.twitter.com/iFG8zxgsWW
2018-06-01 18:34:37,"$GOOGL #Google will not renew controversial Pentagon contract, cloud leader Diane Greene tells employees  https://www.cnbc.com/2018/06/01/google-will-not-renew-a-controversial-pentagon-contract.html … $GOOG $SPY $GLD $SLV $QQQ $DIA $DJIA $IWM $TLT $EEM $ETH $BTC #stockmarket #commodities #investing #finance #stocks #gold #silver #bonds #bitcoin"
2018-06-01 18:30:41,"$TSLA $GOOGL $GOOG As Uber & Tesla struggle with driverless cars, Waymo moves forward  https://arstechnica.com/cars/2018/06/as-uber-and-tesla-struggle-with-driverless-cars-waymo-moves-forward/ … #autonomous #selfdriving #tesla #google #waymo #uber pic.twitter.com/F6OieUhS2X"
2018-06-01 18:27:04,“Expect the best. Prepare for the worst. Capitalize on what comes”~Zig Ziglar #100%Friday $QQQ $LULU $GOOGL $BABA $NVDA $AMZN $TSLA #trading #stocks #stockmarket #daytrader #daytrading #optionstrading #wallstreet #money #investing #scalptrader #swingtrading #BlackBoxStocks ⬛️💖 pic.twitter.com/iSFXlCYrRw
2018-06-01 18:26:20,Goog News is news. And if any of it is true.   It blows up.  Do you remember Amzn and Googl were 990!  So Googl can catch up.
2018-06-01 18:23:56,"Tech Review | Internet Trends 2018, What Mary Meeker Missed  http://www.domainmondo.com/2018/06/tech-review-internet-trends-2018-what.html … #Google $GOOG $GOOGL #investors #technology #antitrust #GDPR #FakeNews #privacy #DataProtection #infosec pic.twitter.com/ZMR3jUVAp7"
2018-06-01 18:22:15,Well. What is there to say.   Best day of my life.  Stunning.   So many Googl.  7 diff layers. Lol. In volume.  Then Amzn. Baba.    Etc.   no one like me. Ask the room.  So many stories.    Room what say you ?
2018-06-01 18:18:33,轉噗 HotpageNews: Waymo and GM just made big moves in the great self-driving-car race $GOOGL $GM - hotpagenews.c... https://plurk.com/p/msjjd4 
2018-06-01 18:15:30,"Market Cap (billions), 4 largest companies (3/9/09 -> Today)... $AAPL: 74 -> 935 $AMZN: 26 -> 796 $GOOGL: 92 -> 788 $MSFT: 135 -> 774 pic.twitter.com/RnX5cYLDSO"
2018-06-01 18:11:59,GOOGL – Google Trading Journal with VantagePoint via @MarketTech https://www.vantagepointsoftware.com/blog/vantagepoint-trading-journal-googl-stock/?utm_source=ReviveOldPost&utm_medium=social&utm_campaign=ReviveOldPost …
2018-06-01 18:10:35,Apple looks to ad growth with new app network $GOOG $GOOGL $AAPL $FB https://seekingalpha.com/news/3361151 
2018-06-01 18:06:59,Monster day in the room w/ @smartertrader   Had $GOOGL $BABA $BIDU $IQ $ISRG and the list goes on.   If you're into checking him out: ask for a trial and tell him NYCPUNTER sent you.
2018-06-01 18:03:03,$GOOGL - Google Won't Seek to Renew Pentagon Contract After Internal Backlash  http://ih.advfn.com/p.php?pid=nmona&article=77577663&adw=1126416 …
2018-06-01 17:59:24,$AAPL $AMZN $NKE $GOOGL #wwdc Apple WWDC: What It Means for Apple’s Stock:  https://www.barrons.com/articles/apple-wwdc-what-it-means-for-apples-stock-1527879070 … pic.twitter.com/B2VqOIKnhP
2018-06-01 17:47:09,$MU $AAPL $BABA $PBR $AMD $FB $BAC $MSFT $AMZN $TSLA $NFLX $INTC $TWTR $PFE $NVDA $GE $LULU $SNAP $JPM $GOOGL $GM $C $F Most active options pic.twitter.com/Ch1vNc2SL4
2018-06-01 17:47:05,Bill Nygren Buys 4 New Stocks in 1st Quarter  https://www.gurufocus.com/news/690145  $REGN $FLEX $FB $GOOGL  pic.twitter.com/LqseNm9lSH
2018-06-01 17:45:04,"REAL TIME TRADE ALERTS via PRIVATE $TWTR FEED, perfect for people who have FT jobs and trade part-time! $AMZN $NFLX $GOOGL $BABA $C $FB"
2018-06-01 17:44:30,Thoughts on GOOGL Jun15 140 c...Jun15 180 call spread  ? or .......better to use  Julys
2018-06-01 17:43:51,Solid Jobs Report Send Stocks Surging -  https://go.shr.lc/2LQpZqI  $SPY $DIA $QQQ $INTC $GOOGL $MA $NFLX $CSCO $NVDA $MSFT $AAPL $JNJ $JPM $BA $FB #stocks #earnings #StockMarket #CNBC
2018-06-01 17:38:56,$GGB $WLL $GE $SEDG $AMZN $BIG $XLNX $PBR $EBAY $LULU $FPI $BABA $NWL $CAH $PAGS $IQ $AMD $GLW $GS $GOOGL $GM $BYD Unusual options activity pic.twitter.com/coUsZDCZA6
2018-06-01 17:31:26,"VUESTROS !!! GOOGL ¡! COMO SE TE CRUCEN LOS CABLES ¡! TE AGUANTAS , DIGO QUE SE  AGUANTEN!!¿?"
2018-06-01 17:27:03,"After a dozen employees quit in protest, Google has reportedly decided not to renew its contract for military drone initiative Project Maven (GOOG, GOOGL)  https://cyberageonline.com/after-a-dozen-employees-quit-in-protest-google-has-reportedly-decided-not-to-renew-its-contract-for-military-drone-initiative-project-maven-goog-googl/ … pic.twitter.com/UfCisF1iUD"
2018-06-01 17:27:01,"After a dozen employees quit in protest, Google has reportedly decided not to renew its contract for military drone initiative Project Maven (GOOG, GOOGL)  https://cyberageonline.com/after-a-dozen-employees-quit-in-protest-google-has-reportedly-decided-not-to-renew-its-contract-for-military-drone-initiative-project-maven-goog-googl/ … pic.twitter.com/QXE7EQePrl"
2018-06-01 17:26:58,"After a dozen employees quit in protest, Google has reportedly decided not to renew its contract for military drone initiative Project Maven (GOOG, GOOGL)  https://cyberageonline.com/after-a-dozen-employees-quit-in-protest-google-has-reportedly-decided-not-to-renew-its-contract-for-military-drone-initiative-project-maven-goog-googl/ … pic.twitter.com/vc3v6eVwxB"
2018-06-01 17:26:56,"After a dozen employees quit in protest, Google has reportedly decided not to renew its contract for military drone initiative Project Maven (GOOG, GOOGL)  https://cyberageonline.com/after-a-dozen-employees-quit-in-protest-google-has-reportedly-decided-not-to-renew-its-contract-for-military-drone-initiative-project-maven-goog-googl/ … pic.twitter.com/dDbhgn2hgc"
2018-06-01 17:26:54,"After a dozen employees quit in protest, Google has reportedly decided not to renew its contract for military drone initiative Project Maven (GOOG, GOOGL)  https://cyberageonline.com/after-a-dozen-employees-quit-in-protest-google-has-reportedly-decided-not-to-renew-its-contract-for-military-drone-initiative-project-maven-goog-googl/ … pic.twitter.com/SH7jPqdh57"
2018-06-01 17:24:47,"Waymo adds 62,000 vehicles for autonomous taxi service  https://dailym.ai/2H8bz1D  via @MailOnline $GOOGL not done -- needs $60 to ATH which it will reach soon"
2018-06-01 17:20:33,#Employment #rally $FB $GOOGL $JPM $BAC $WFC $AAPL $PM $PG $GE $HON $JNJ $CSCO $MSFT $INTC $TWTR $TSLA $V $DIS $UNH $VZ $KHC $SLB $XOM $ES_F $GC_F $NQ_F $CL_F $ZB_F $TLT $MET $PNC $CTL $LMT $WMT $TGT $DLTR $AMZN $AMGN $BMY $IBM $SPX $NASDAQ $DJIA $CAC $DAX $FTSE $BTC $CAT $RIG pic.twitter.com/61X4XyMWBx
2018-06-01 17:18:33,$AAPL #APPLE $ESND $NANO $PES $FB $GOOG $GOOGL  https://seekingalpha.com/article/4178933-top-performing-stocks-may?source=feed_f …
2018-06-01 17:15:04,NOW OFFERING 7 Day FREE Trial to  options day trading team Room or $TWTR feed   http://ow.ly/1fVf30kioOh  $FB $AAPL $NFLX $TSLA $AMZN $GOOGL
2018-06-01 17:05:04,"Alphabet Inc.(""Google"") - Class A (GOOGL) price at close, 2018-06-01, is 1132.39.  pic.twitter.com/zRS32QYGVC"
2018-06-01 17:03:18,"Alphabet Inc.(""Google"") - Class A (GOOGL) price at close, 2018-06-01, is 1132.39 USD. #Stocks #Google #GOOGL"
2018-06-01 17:00:10,"Alphabet Inc.(""Google"") - Class A (GOOGL) price at close, 2018-06-01, is 1132.39."
2018-06-01 16:59:18,"After a dozen employees quit in protest, Google has reportedly decided not to renew its contract for military drone initiative Project Maven (GOOG, GOOGL)  http://dlvr.it/QVtq6j  pic.twitter.com/b0V0bhGwiv"
2018-06-01 16:59:13,#Options #maxpain chart for $GOOGL. Free options app  http://www.mobileinteractive.com/superstocks  pic.twitter.com/7yVxVOY1iC
2018-06-01 16:57:07,"After a dozen employees quit in protest, Google has reportedly decided not to renew its contract for military drone initiative Project Maven (GOOG, GOOGL)  https://ift.tt/2kHvdcb "
2018-06-01 16:56:54," https://www.cnbc.com/2018/04/04/google-workers-urge-ceo-sundar-pichai-to-pull-out-of-pentagon-project.html … $GOOGL   So war is bad ,huh?  Luckily collecting teraBytes of info on all ppl still  cool !! .. Like a #Zuckerberg'Boss"
2018-06-01 16:56:46,"Alphabet ($GOOGL) should form Alpha Defense, Inc., transfer some Alpha Engineers, double their salaries, put them under contract, and embrace the drones.  https://twitter.com/FoxNews/status/1002654376555577344 …"
2018-06-01 16:56:23,More than enough testimonies on our trade alerts from happy members.  Let the next testimony come from you.   http://bit.ly/2q2awKg . $LULU $TWTR $AAPL $MU $GOOGL $BIDU most tweeted early this morning.  All did great
2018-06-01 16:52:19,$AXP $BABA $BAC $C $FB $GOOGL $MA $V $GOOG https://seekingalpha.com/article/4178607-financial-crisis-provided-greatest-investment-lessons?source=tweet …
2018-06-01 16:52:18,Today's Option trade #1:  $IQ $30 Call 9/21/18 from 1.95 out 2.6  $GOOGL $1500 Call 1/18/19 from 2.75 out 4.6 $BABA $230 Call 7/20/2018 from .94 out .975  $SQ $70 Call 1/18/2019 from 3.35 out 4.45 $SQ $70 Call 1/17/20 from 5.1 out 6.25 $INTC $75 Call 1/17/20 from 2.035 out 2.45
2018-06-01 16:52:09,"After a dozen employees quit in protest, Google has reportedly decided not to renew its contract for military drone initiative Project Maven (GOOG, GOOGL)  https://ift.tt/2kHvdcb  johnangel1977"
2018-06-01 16:51:41,$XLK $VGT $TECL $FTEC $IYW $ROM $QTEC $RYT $FNG $TECS $IGM $FXL $XNTK $REW $JHMT $XITK $TCHF $FB $GOOG $GOOGL $SPY https://seekingalpha.com/article/4178724-bigger-tech-bubble-today-one-2000-question-unicorns?source=tweet …
2018-06-01 16:51:23,"10 Things To Know. After a dozen employees quit in protest, Google has reportedly decided not to renew its contract for military drone initiative Project Maven (GOOG, GOOGL)  https://ift.tt/2kHvdcb "
2018-06-01 16:51:12,"After a dozen employees quit in protest, Google has reportedly decided not to renew its contract for military drone initiative Project Maven (GOOG, GOOGL)  https://ift.tt/2kHvdcb "
2018-06-01 16:50:52,$OKE $KMI $TRTN $LMT $AMZN $LVMUY $PM $AWK $MKC $DEA $AAPL $MSFT $GOOG $GOOGL $V $MA $CNI $NSC $BLK $NSRGY https://seekingalpha.com/article/4178461-plan-earn-1000-000-tax-free-least-tax-deferred?source=tweet …
2018-06-01 16:50:27,"After a dozen employees quit in protest, Google has reportedly decided not to renew its contract for military drone initiative Project Maven (GOOG, GOOGL)  https://read.bi/2JkjjTj "
2018-06-01 16:47:24,MAYORIA !¡ LO BUENO QUE TIENE SER BUENA ¡¡ HAY TE LAS APAÑES !!¡??GOOGL ¡¡ QUÉ MALLLL DIGO QUE MALO ! PLIS YO DUERMO EN LA MARCA  HUYTSAAT!¡¿?¡¡🤣🤣🤣🤣🤣🤣🤣
2018-06-01 16:45:02,"#Technology and #Biotech #Stocks Rule The Land - ""Risk-On"" Is Back  https://mottcapitalmanagement.com/technology-and-biotech-stocks-rule-the-land-risk-on-is-back/ … via @jay110429 $XBI $XLK $SPY $SPX #SP500 $GOOGL $AAPL $NFLX $AMZN $FB $MSFT"
2018-06-01 16:43:40,"After a dozen employees quit in protest, Google has reportedly decided not to renew its contract for military drone initiative Project Maven $GOOG $GOOGL  https://read.bi/2Lf0IFM  pic.twitter.com/oxC08pQ2vW"
2018-06-01 16:43:33,Had good day/week too but still bitching to myself about closing googl and baba yesterday. Focus too much on what I missed instead of reentering this morning. So amateur. LoL
2018-06-01 16:40:39,Price Moves vs Expected Moves $TWTR $AMD $INTC $GOOGL $BIDU $NVDA $SNAP $MU $SQ $MSFT $FB $T  https://marketchameleon.com/Home/Dashboard/ 
2018-06-01 16:39:58,"Positions [06/01/2018] High/Low $BA $AMZN $AAPL $AVGO $NVDA $RTN $ISRG $NFLX $FB $MCD $VRTX $PYPL $GM $BBU Cash 19.9%. Exited $GOOGL Reduced $VRTX Increased; $NFLX $PYPL Need pullbacks on $AMZN $ISRG otherwise holds. $GOOGL apart from privacy issues, yo-yo valuations ↕️"
2018-06-01 16:31:58,The Most Overcrowded Bubble Market Trade $QQQ $AAPL $AMZN $MSFT $NFLX $NVDA $ERO $FB $GOOGL  https://goo.gl/3dUHN9 
2018-06-01 16:27:44,"Waymo, the $GOOGL autonomous driving division, ordered 62,000 vehicles from $FCAU.   — David Faber, Squawk on the Street #TradersEdge"
2018-06-01 16:27:04,"$SPY We've spent the last few weeks retesting the 61.8 fib from major high to low, daily chart bullish and weekly chart showing bullish candle as well as support from the 12 and 20 ma, hopefully we get breakout next week! $SPX $ES_F $FB $AAPL $MU $GOOGL $AMZN $NFLX $SQ pic.twitter.com/8nTMlPx7Ty"
2018-06-01 16:24:53,TTG End of Day Recap  - big day of call buying  - also nice to see 1st of month flows are adding $ not taking $ out  - winners for me today $TWLO $AAPL $XLNX $NVDA $KWEB $VEEV $GOOGL etc losers $MLCO $SCPH  - call activity $XLNX $EEM $TWTR $HIMX $NWL $PSTG $MSFT $TRIP $ROKU $FDC pic.twitter.com/JDyLBmoyy0
2018-06-01 16:21:05,$GOOGL closed at exactly gap fill resistance. Will eye this for a short next week.
2018-06-01 16:19:08,googl - #GOOGL chart  http://www.tradingview.com/chart/GOOGL/mZkOyeaL-googl/ …
2018-06-01 16:18:34,"Stewie-thank you for tweeting some great set ups this week-some huge winners in MOMO,IQ,GOOGL etc"
2018-06-01 16:15:42,🔥FRIDAY'S ACTIVE FLOW: $MU $BABA $AAPL $PBR $AMD $FB $TSLA $SNAP $MSFT $AMZN $GOOGL $INTC $TWTR $JPM $INTC $GOOGL $BIDU $SQ $GS $JD $PAGS pic.twitter.com/oAE3GqLKiT
2018-06-01 16:15:04,"REAL TIME TRADE ALERTS via PRIVATE $TWTR FEED, perfect for people who have FT jobs and trade part-time! $AMZN $NFLX $GOOGL $BIIB $GS $FB"
2018-06-01 16:08:50,"Al cierre de la jornada de hoy, Alphabet Inc. $GOOGL alcanzó un precio de $1119.5 dólares por acción. Tuvo un cambio de 3.18% con respecto al cierre del día anterior."
2018-06-01 16:07:09,Are you Bullish or Bearish on #Google🖥?  1 - 15x Leverage ✅ ▶️  http://AirdropKitties.com/  ◀️  Register Now & go Long📈 or Short📉 on #GOOGL with #Bitcoin ✅ #Stocks #Trading #Blockchain #Crypto #Cryptocurrency #Ethereum #Ripple #Monero #EOS #NEO #Litecoin #IOTA #Dogecoin pic.twitter.com/UGvDNp5B24
2018-06-01 16:06:03,Today's million dollar CALL #options trade: $AMZN $FB $FXE $GM $GOOGL $INTC $JPM $KEYS $MU $SPY $TRIP $DIA $F $GOOG $GS $NFLX $TSLA $VKTX $BABA $LULU ... https://appsto.re/i6hH3LG 
2018-06-01 16:00:45,"Morgan Stanley figured out how much YouTube would be worth if it were a separate company, and it's more valuable than Disney (GOOG, GOOGL) #marketing  https://cmun.it/wnz6ot  (Want this? The easiest way to grow followers for free - It's Magical! 🆓  https://commun.it/?aid=content_69 )"
2018-06-01 15:59:32,"ok, into the weekend, I have some very small positions in (as in no more than 8 of each, but mostly 2 or 3 of each):   AAPL GOOGL FB AMZN BABA OLED VEEV QRVO LRCX NVDA  and a pile of cash.   Hope everyone had a great day today at least, if not a great week."
2018-06-01 15:59:29,$BVTK-  I added!!  Amazing where this is going!!!  One Tic left!!  $AMZN $BA $HON $SBUX $MFST $DIS $ADBE $CRUS $ATV $GOOGL $HD $HAL $T $TV $VZ $GE $NEWR $ADBE $HAS $OKTA $NVDA
2018-06-01 15:50:02,"Stocks making the biggest moves premarket: DB, GOOGL, AAPL, BABA, COST, TWTR & more -  http://financialconsultant.blog/stocks-making-the-biggest-moves-premarket-db-googl-aapl-baba-cost-twtr-more/ … pic.twitter.com/yg9p61n5ER"
2018-06-01 15:49:35,$GOOG $GOOGL  https://twitter.com/CNBC/status/1002637835751559168 …
2018-06-01 15:45:03,NOW OFFERING 7 Day FREE Trial to  options day trading team Room or $TWTR feed   http://ow.ly/Q91b30kioOb  $CELG $AAPL $NFLX $TSLA $AMZN $GOOGL
2018-06-01 15:35:47,"BABA looks * very * close to a HOD b/o. If it does, I'll sell 1/2   FB AAPL AMZN holding well  NFLX non stop   GOOGL profit taking after 2 $35+ days in a row, not surprising"
2018-06-01 15:31:12,what do you think about googl?
2018-06-01 15:30:09,ACTIVE TRADERS Try one of these FREE trading guides:   http://ow.ly/wbGi30kip0u  $NFLX $TSLA $AAPL $PCLN $GS $FB $AMZN $GOOGL $NVDA
2018-06-01 15:29:00,If you're going to make it in this business you better master this particular aspect of trading.    You'll come away with a better understanding of risk and reward  #stocks $AAPL $GOOGL $LULU $UAA http://bit.ly/2rqdKYz 
2018-06-01 15:17:10, http://42stocks.com  $ABMD $ADSK $AMD $ANET $ATHM $BLUE $BRFS $CLR $CVRR $DK $DVMT $DXCM $EBAY $GOOGL $HFC $IDXX $ING $ISRG $JD $KORS $LULU $MOMO $MU $NKTR $NTNX $PRU $STT $TM $TRMB $TWTR $UNP $URI $VMW pic.twitter.com/cv42CLBgYY
2018-06-01 15:14:53,Swing longs:  CMG AGN  $AGN $GOOGL $SPy $SPX IWM
2018-06-01 15:14:03,#Apple looks to ad growth with new app network $GOOG $GOOGL $AAPL $FB #Advertising https://seekingalpha.com/news/3361151 
2018-06-01 15:13:03,opinion on my GOOGL june22 102 1/2’s... would you hold for a few more or cash out? just wondering
2018-06-01 15:10:03,"We hit lightning in a bottle yesterday with Google, we’ll roll up for a free trade here. SOLD GOOGL JUL 1080 CALL AT 68 (IN YESTERDAY AT 34) BOUGHT GOOGL JUL 1135 CALL AT 31"
2018-06-01 15:06:12,"El Page Rank ya no será público El PageRank (PR) ,indicador que nos proporcionaba Googl  https://perumira.org/el-page-rank-ya-no-sera-publico/?utm_source=ReviveOldPost&utm_medium=social&utm_campaign=ReviveOldPost … #apps #digital #PerúMira"
2018-06-01 15:04:18,"Closed today for profit today  - BABA, XOP, AMZN, TSLA (NFLX pending order fill) Sitting on GOOGL, (new) AMZN, MU"
2018-06-01 15:02:04,Laikn news mai tou ni aya aor na hi mjhe googl pr koi aisi news mili k stay ordr grant kr diya ho...ap ko kdr se pta chala confrm
2018-06-01 15:00:28,"16 Jahre???.. Falsche Wimpern, Plastik Nägel, Googl weiß alles, aber Geräusche machen Angst 😭😭😭  pic.twitter.com/dXh3VJp4Yl"
2018-06-01 14:57:11,"JUST IN via @Gizmodo: Google plans to end its contract for Project Maven, which provides drone footage analysis to the Defense Department. The program had come under scrutiny as thousands of employees signed a petition to cancel the contract. $GOOGL  http://gizmodo.com/google-plans-not-to-renew-its-contract-for-project-mave-1826488620?utm_medium=sharefromsite&utm_source=Gizmodo_twitter …"
2018-06-01 14:55:01,GOOGL - what is the play here?
2018-06-01 14:54:32,POOR stock Clown missing the gains in $AMZN $GOOGL $NVDA $SPY $BA $NFLX  because they choose to be bearish and wrong the big picture since $SPY 225 no skill  but not me the big picture expert telling people to buy and win instead with great plans also $TWTR poor stock clowns
2018-06-01 14:54:03,"The Economy Is on a Roll, and It\'s Bringing the Stock Market With It $SPY $QQQ $LULU $XLY $VMW $GOOGL $MLM $REGN  https://marketrealist.com/2018/06/the-economy-is-on-a-roll-and-its-bringing-the-stock-market-along-with-it … pic.twitter.com/uAkeab0xLN"
2018-06-01 14:53:36,$AMZN partners with $BLNK to bring the highest quality EV charging stations to Whole Foods. Accepts $AAPL Pay & $GOOGL Pay as payments.  pic.twitter.com/ElK5lN3F2D
2018-06-01 14:47:16, http://42stocks.com  $ABMD $ADSK $AMD $ANET $ATHM $BLUE $BRFS $CLR $DK $DVMT $DXCM $GOOGL $HFC $IDXX $ING $ISRG $JD $KORS $LULU $MOMO $MU $NKTR $NTNX $PRU $STT $TM $TRMB $TWTR $UNP $URI $VMW pic.twitter.com/rqG5uoxtji
2018-06-01 14:45:05,"REAL TIME TRADE ALERTS via PRIVATE $TWTR FEED, perfect for people who have FT jobs and trade part-time! $AMZN $NFLX $GOOGL $BABA SMU $FB"
